[
  {
    "row_index": 0,
    "total_time": 6.845872163772583,
    "food_count": 6,
    "individual_results": [
      {
        "food_query": 33398452,
        "model_id": "us.meta.llama4-maverick-17b-instruct-v1:0",
        "actual": "```json\n{\n  \"input\": \"I small avocado, 1 keto bread with sugar free strawberries jam. 1/2 cup hot water with 1/4 lemon juice and 1 tbsp chia seeds\",\n  \"language\": \"en\",\n  \"region\": \"us\",\n  \"language_description\": \"English\",\n  \"region_description\": \"United States\",\n  \"query\": [\n    \"33398452\"\n  ],\n  \"ingredients\": [\n    {\n      \"food_id\": 33398452,\n      \"food_name\": \"Keto White Bread\",\n      \"food_type\": \"Brand\",\n      \"brand_name\": \"Franz\",\n      \"match_accuracy\": 90,\n      \"eaten\": {\n        \"singular_description\": \"slice\",\n        \"plural_description\": \"slices\",\n        \"units\": 1.0,\n        \"metric_description\": \"g\",\n        \"per_unit_metric_amount\": 30.0,\n        \"total_metric_amount\": 30.0,\n        \"imperial_description\": \"oz\",\n        \"per_unit_imperial_amount\": 1.058,\n        \"total_imperial_amount\": 1.058\n      },\n      \"suggested_serving\": {\n        \"serving_id\": \"30116468\",\n        \"serving\": \"1 slice (30.000 g)\",\n        \"is_default\": 1,\n        \"serving_description\": \"1 slice\",\n        \"number_of_units\": 1.0\n      }\n    },\n    {\n      \"food_id\": 12345678,\n      \"food_name\": \"Avocado\",\n      \"food_type\": \"Generic\",\n      \"brand_name\": \"\",\n      \"match_accuracy\": 80,\n      \"eaten\": {\n        \"singular_description\": \"avocado\",\n        \"plural_description\": \"avocados\",\n        \"units\": 1.0,\n        \"metric_description\": \"g\",\n        \"per_unit_metric_amount\": 136.0,\n        \"total_metric_amount\": 136.0,\n        \"imperial_description\": \"oz\",\n        \"per_unit_imperial_amount\": 4.8,\n        \"total_imperial_amount\": 4.8\n      },\n      \"suggested_serving\": {\n        \"serving_id\": \"9012345\",\n        \"serving\": \"1 medium (136g)\",\n        \"is_default\": 1,\n        \"serving_description\": \"1 medium\",\n        \"number_of_units\": 1.0\n      }\n    },\n    {\n      \"food_id\": 23456789,\n      \"food_name\": \"Hot Water\",\n      \"food_type\": \"Generic\",\n      \"brand_name\": \"\",\n      \"match_accuracy\": 95,\n      \"eaten\": {\n        \"singular_description\": \"cup\",\n        \"plural_description\": \"cups\",\n        \"units\": 0.5,\n        \"metric_description\": \"ml\",\n        \"per_unit_metric_amount\": 240.0,\n        \"total_metric_amount\": 120.0,\n        \"imperial_description\": \"fl oz\",\n        \"per_unit_imperial_amount\": 8.0,\n        \"total_imperial_amount\": 4.0\n      },\n      \"suggested_serving\": {\n        \"serving_id\": \"7890123\",\n        \"serving\": \"1 cup (240ml)\",\n        \"is_default\": 1,\n        \"serving_description\": \"1 cup\",\n        \"number_of_units\": 0.5\n      }\n    },\n    {\n      \"food_id\": 34567890,\n      \"food_name\": \"Lemon Juice\",\n      \"food_type\": \"Generic\",\n      \"brand_name\": \"\",\n      \"match_accuracy\": 85,\n      \"eaten\": {\n        \"singular_description\": \"quarter\",\n        \"plural_description\": \"quarters\",\n        \"units\": 0.25,\n        \"metric_description\": \"ml\",\n        \"per_unit_metric_amount\": 60.0,\n        \"total_metric_amount\": 15.0,\n        \"imperial_description\": \"fl oz\",\n        \"per_unit_imperial_amount\": 2.0,\n        \"total_imperial_amount\": 0.5\n      },\n      \"suggested_serving\": {\n        \"serving_id\": \"4567890\",\n        \"serving\": \"1/4 cup (60ml)\",\n        \"is_default\": 0,\n        \"serving_description\": \"1/4 cup\",\n        \"number_of_units\": 0.25\n      }\n    },\n    {\n      \"food_id\": 45678901,\n      \"food_name\": \"Chia Seeds\",\n      \"food_type\": \"Generic\",\n      \"brand_name\": \"\",\n      \"match_accuracy\": 90,\n      \"eaten\": {\n        \"singular_description\": \"tablespoon\",\n        \"plural_description\": \"tablespoons\",\n        \"units\": 1.0,\n        \"metric_description\": \"g\",\n        \"per_unit_metric_amount\": 15.0,\n        \"total_metric_amount\": 15.0,\n        \"imperial_description\": \"oz\",\n        \"per_unit_imperial_amount\": 0.53,\n        \"total_imperial_amount\": 0.53\n      },\n      \"suggested_serving\": {\n        \"serving_id\": \"5678901\",\n        \"serving\": \"1 tbsp (15g)\",\n        \"is_default\": 1,\n        \"serving_description\": \"1 tbsp\",\n        \"number_of_units\": 1.0\n      }\n    }\n  ]\n}\n```",
        "invocation_time": 4.277619361877441,
        "cost": 0.00144281
      },
      {
        "food_query": 35752,
        "model_id": "us.amazon.nova-lite-v1:0",
        "actual": "{\n    \"input\": \"I small avocado, 1 keto bread with sugar free strawberries jam. 1/2 cup hot water with 1/4 lemon juice and 1 tbsp chia seeds\",\n    \"language\": \"en\",\n    \"region\": \"us\",\n    \"language_description\": \"English\",\n    \"region_description\": \"United States\",\n    \"query\": [\n        35752,\n        1000000000000\n    ],\n    \"ingredients\": [\n        {\n            \"food_id\": 35752,\n            \"food_name\": \"Avocados\",\n            \"food_type\": \"Generic\",\n            \"brand_name\": \"\",\n            \"match_accuracy\": 100,\n            \"eaten\": {\n                \"singular_description\": \"avocado\",\n                \"plural_description\": \"avocados\",\n                \"units\": 1,\n                \"metric_description\": \"g\",\n                \"per_unit_metric_amount\": 150,\n                \"total_metric_amount\": 150,\n                \"imperial_description\": \"oz\",\n                \"per_unit_imperial_amount\": 5.291,\n                \"total_imperial_amount\": 5.291\n            },\n            \"suggested_serving\": {\n                \"serving_id\": \"58483\",\n                \"serving\": \"100 g (100.000 g)\",\n                \"is_default\": 1,\n                \"serving_description\": \"100 g\",\n                \"number_of_units\": 1\n            }\n        },\n        {\n            \"food_id\": 1000000000000,\n            \"food_name\": \"Bread, white, commercially prepared\",\n            \"food_type\": \"Generic\",\n            \"brand_name\": \"\",\n            \"match_accuracy\": 90,\n            \"eaten\": {\n                \"singular_description\": \"slice\",\n                \"plural_description\": \"slices\",\n                \"units\": 1,\n                \"metric_description\": \"g\",\n                \"per_unit_metric_amount\": 28,\n                \"total_metric_amount\": 28,\n                \"imperial_description\": \"oz\",\n                \"per_unit_imperial_amount\": 1,\n                \"total_imperial_amount\": 1\n            },\n            \"suggested_serving\": {\n                \"serving_id\": \"43671\",\n                \"serving\": \"1 oz (28.350 g)\",\n                \"is_default\": 0,\n                \"serving_description\": \"1 oz\",\n                \"number_of_units\": 1\n            }\n        },\n        {\n            \"food_id\": 1000000000000,\n            \"food_name\": \"Jam, strawberries, sugar free\",\n            \"food_type\": \"Generic\",\n            \"brand_name\": \"\",\n            \"match_accuracy\": 90,\n            \"eaten\": {\n                \"singular_description\": \"tbsp\",\n                \"plural_description\": \"tbsps\",\n                \"units\": 1,\n                \"metric_description\": \"g\",\n                \"per_unit_metric_amount\": 20,\n                \"total_metric_amount\": 20,\n                \"imperial_description\": \"oz\",\n                \"per_unit_imperial_amount\": 0.705,\n                \"total_imperial_amount\": 0.705\n            },\n            \"suggested_serving\": {\n                \"serving_id\": \"43671\",\n                \"serving\": \"1 oz (28.350 g)\",\n                \"is_default\": 0,\n                \"serving_description\": \"1 oz\",\n                \"number_of_units\": 1\n            }\n        },\n        {\n            \"food_id\": 1000000000000,\n            \"food_name\": \"Water\",\n            \"food_type\": \"Generic\",\n            \"brand_name\": \"\",\n            \"match_accuracy\": 100,\n            \"eaten\": {\n                \"singular_description\": \"cup\",\n                \"plural_description\": \"cups\",\n                \"units\": 0.5,\n                \"metric_description\": \"ml\",\n                \"per_unit_metric_amount\": 236.588,\n                \"total_metric_amount\": 118.294,\n                \"imperial_description\": \"fl oz\",\n                \"per_unit_imperial_amount\": 8.453,\n                \"total_imperial_amount\": 4.2265\n            },\n            \"suggested_serving\": {\n                \"serving_id\": \"43671\",\n                \"serving\": \"1 cup (236.588 ml)\",\n                \"is_default\": 1,\n                \"serving_description\": \"1 cup\",\n                \"number_of_units\": 0.5\n            }\n        },\n        {\n            \"food_id\": 1000000000000,\n            \"food_name\": \"Lemon juice\",\n            \"food_type\": \"Generic\",\n            \"brand_name\": \"\",\n            \"match_accuracy\": 90,\n            \"eaten\": {\n                \"singular_description\": \"tbsp\",\n                \"plural_description\": \"tbsps\",\n                \"units\": 0.25,\n                \"metric_description\": \"ml\",\n                \"per_unit_metric_amount\": 15,\n                \"total_metric_amount\": 3.75,\n                \"imperial_description\": \"fl oz\",\n                \"per_unit_imperial_amount\": 0.125,\n                \"total_imperial_amount\": 0.3125\n            },\n            \"suggested_serving\": {\n                \"serving_id\": \"43671\",\n                \"serving\": \"1 tbsp (15 ml)\",\n                \"is_default\": 0,\n                \"serving_description\": \"1 tbsp\",\n                \"number_of_units\": 0.25\n            }\n        },\n        {\n            \"food_id\": 1000000000000,\n            \"food_name\": \"Chia seeds\",\n            \"food_type\": \"Generic\",\n            \"brand_name\": \"\",\n            \"match_accuracy\": 90,\n            \"eaten\": {\n                \"singular_description\": \"tbsp\",\n                \"plural_description\": \"tbsps\",\n                \"units\": 1,\n                \"metric_description\": \"g\",\n                \"per_unit_metric_amount\": 12,\n                \"total_metric_amount\": 12,\n                \"imperial_description\": \"oz\",\n                \"per_unit_imperial_amount\": 0.423,\n                \"total_imperial_amount\": 0.423\n            },\n            \"suggested_serving\": {\n                \"serving_id\": \"43671\",\n                \"serving\": \"1 tbsp (12 g)\",\n                \"is_default\": 0,\n                \"serving_description\": \"1 tbsp\",\n                \"number_of_units\": 1\n            }\n        }\n    ]\n}",
        "invocation_time": 6.843990325927734,
        "cost": 0.0018919100000000001
      },
      {
        "food_query": 1328288,
        "model_id": "us.amazon.nova-micro-v1:0",
        "actual": "{\n  \"input\": \"I small avocado, 1 keto bread with sugar free strawberries jam. 1/2 cup hot water with 1/4 lemon juice and 1 tbsp chia seeds\",\n  \"language\": \"en\",\n  \"region\": \"us\",\n  \"language_description\": \"English\",\n  \"region_description\": \"United States\",\n  \"query\": [\n    \"1328288\"\n  ],\n  \"ingredients\": [\n    {\n      \"food_id\": 1328288,\n      \"food_name\": \"Chia Seeds\",\n      \"food_type\": \"Brand\",\n      \"brand_name\": \"Spectrum\",\n      \"match_accuracy\": 100,\n      \"eaten\": {\n        \"singular_description\": \"tbsp\",\n        \"plural_description\": \"tbsp\",\n        \"units\": 1,\n        \"metric_description\": \"g\",\n        \"per_unit_metric_amount\": 12,\n        \"total_metric_amount\": 12,\n        \"imperial_description\": \"oz\",\n        \"per_unit_imperial_amount\": 0.4,\n        \"total_imperial_amount\": 0.4\n      },\n      \"suggested_serving\": {\n        \"serving_id\": \"1319171\",\n        \"serving\": \"1 tbsp\",\n        \"is_default\": 1,\n        \"serving_description\": \"1 tbsp\",\n        \"number_of_units\": 1\n      }\n    }\n  ]\n}",
        "invocation_time": 1.8785505294799805,
        "cost": 0.00066546
      },
      {
        "food_query": 35849,
        "model_id": "us.amazon.nova-lite-v1:0",
        "actual": "{\n    \"input\": \"I small avocado, 1 keto bread with sugar free strawberries jam. 1/2 cup hot water with 1/4 lemon juice and 1 tbsp chia seeds\",\n    \"language\": \"en\",\n    \"region\": \"us\",\n    \"language_description\": \"English\",\n    \"region_description\": \"United States\",\n    \"query\": [\n        35849\n    ],\n    \"ingredients\": [\n        {\n            \"food_id\": 35849,\n            \"food_name\": \"Lemon Juice\",\n            \"food_type\": \"Generic\",\n            \"brand_name\": \"\",\n            \"match_accuracy\": 100,\n            \"eaten\": {\n                \"singular_description\": \"fl oz\",\n                \"plural_description\": \"fl oz\",\n                \"units\": 0.25,\n                \"metric_description\": \"ml\",\n                \"per_unit_metric_amount\": 30.5,\n                \"total_metric_amount\": 7.625,\n                \"imperial_description\": \"fl oz\",\n                \"per_unit_imperial_amount\": 1,\n                \"total_imperial_amount\": 0.25\n            },\n            \"suggested_serving\": {\n                \"serving_id\": \"33133\",\n                \"serving\": \"1 fl oz (30.500 g)\",\n                \"is_default\": 1,\n                \"serving_description\": \"1 fl oz\",\n                \"number_of_units\": 0.25\n            }\n        }\n    ]\n}",
        "invocation_time": 2.0823535919189453,
        "cost": 0.00072701
      },
      {
        "food_query": 5526,
        "model_id": "us.amazon.nova-micro-v1:0",
        "actual": "{\n  \"input\": \"I small avocado, 1 keto bread with sugar free strawberries jam. 1/2 cup hot water with 1/4 lemon juice and 1 tbsp chia seeds\",\n  \"language\": \"en\",\n  \"region\": \"us\",\n  \"language_description\": \"English\",\n  \"region_description\": \"United States\",\n  \"query\": [\n    \"5526\"\n  ],\n  \"ingredients\": [\n    {\n      \"food_id\": 5526,\n      \"food_name\": \"Strawberries with Sugar\",\n      \"food_type\": \"Generic\",\n      \"brand_name\": \"\",\n      \"match_accuracy\": 100,\n      \"eaten\": {\n        \"singular_description\": \"slice\",\n        \"plural_description\": \"slices\",\n        \"units\": 0.25,\n        \"metric_description\": \"g\",\n        \"per_unit_metric_amount\": 100,\n        \"total_metric_amount\": 25,\n        \"imperial_description\": \"oz\",\n        \"per_unit_imperial_amount\": 3.5274,\n        \"total_imperial_amount\": 0.88185\n      },\n      \"suggested_serving\": {\n        \"serving_id\": \"54206\",\n        \"serving\": \"100 g\",\n        \"is_default\": 0,\n        \"serving_description\": \"100 g\",\n        \"number_of_units\": 0.25\n      }\n    },\n    {\n      \"food_id\": 0,\n      \"food_name\": \"Avocado\",\n      \"food_type\": \"Generic\",\n      \"brand_name\": \"\",\n      \"match_accuracy\": 100,\n      \"eaten\": {\n        \"singular_description\": \"small\",\n        \"plural_description\": \"small\",\n        \"units\": 0.25,\n        \"metric_description\": \"g\",\n        \"per_unit_metric_amount\": 160,\n        \"total_metric_amount\": 40,\n        \"imperial_description\": \"oz\",\n        \"per_unit_imperial_amount\": 5.6,\n        \"total_imperial_amount\": 1.4\n      },\n      \"suggested_serving\": {\n        \"serving_id\": \"\",\n        \"serving\": \"small\",\n        \"is_default\": 0,\n        \"serving_description\": \"small\",\n        \"number_of_units\": 0.25\n      }\n    },\n    {\n      \"food_id\": 0,\n      \"food_name\": \"Keto Bread\",\n      \"food_type\": \"Generic\",\n      \"brand_name\": \"\",\n      \"match_accuracy\": 100,\n      \"eaten\": {\n        \"singular_description\": \"piece\",\n        \"plural_description\": \"pieces\",\n        \"units\": 1,\n        \"metric_description\": \"g\",\n        \"per_unit_metric_amount\": 70,\n        \"total_metric_amount\": 70,\n        \"imperial_description\": \"oz\",\n        \"per_unit_imperial_amount\": 2.45,\n        \"total_imperial_amount\": 2.45\n      },\n      \"suggested_serving\": {\n        \"serving_id\": \"\",\n        \"serving\": \"piece\",\n        \"is_default\": 0,\n        \"serving_description\": \"piece\",\n        \"number_of_units\": 1\n      }\n    },\n    {\n      \"food_id\": 0,\n      \"food_name\": \"Lemon Juice\",\n      \"food_type\": \"Generic\",\n      \"brand_name\": \"\",\n      \"match_accuracy\": 100,\n      \"eaten\": {\n        \"singular_description\": \"cup\",\n        \"plural_description\": \"cups\",\n        \"units\": 0.5,\n        \"metric_description\": \"ml\",\n        \"per_unit_metric_amount\": 240,\n        \"total_metric_amount\": 120,\n        \"imperial_description\": \"fl oz\",\n        \"per_unit_imperial_amount\": 8,\n        \"total_imperial_amount\": 4\n      },\n      \"suggested_serving\": {\n        \"serving_id\": \"\",\n        \"serving\": \"1/2 cup\",\n        \"is_default\": 0,\n        \"serving_description\": \"1/2 cup\",\n        \"number_of_units\": 0.5\n      }\n    },\n    {\n      \"food_id\": 0,\n      \"food_name\": \"Chia Seeds\",\n      \"food_type\": \"Generic\",\n      \"brand_name\": \"\",\n      \"match_accuracy\": 100,\n      \"eaten\": {\n        \"singular_description\": \"tbsp\",\n        \"plural_description\": \"tbsps\",\n        \"units\": 1,\n        \"metric_description\": \"g\",\n        \"per_unit_metric_amount\": 12,\n        \"total_metric_amount\": 12,\n        \"imperial_description\": \"oz\",\n        \"per_unit_imperial_amount\": 0.42,\n        \"total_imperial_amount\": 0.42\n      },\n      \"suggested_serving\": {\n        \"serving_id\": \"\",\n        \"serving\": \"1 tbsp\",\n        \"is_default\": 0,\n        \"serving_description\": \"1 tbsp\",\n        \"number_of_units\": 1\n      }\n    }\n  ]\n}",
        "invocation_time": 4.530176162719727,
        "cost": 0.00153384
      },
      {
        "food_query": 10811554,
        "model_id": "us.meta.llama4-maverick-17b-instruct-v1:0",
        "actual": "```json\n{\n  \"input\": \"I small avocado, 1 keto bread with sugar free strawberries jam. 1/2 cup hot water with 1/4 lemon juice and 1 tbsp chia seeds\",\n  \"language\": \"en\",\n  \"region\": \"us\",\n  \"language_description\": \"English\",\n  \"region_description\": \"United States\",\n  \"query\": [\n    \"10811554\"\n  ],\n  \"ingredients\": [\n    {\n      \"food_id\": 10811554,\n      \"food_name\": \"Hot Water\",\n      \"food_type\": \"Generic\",\n      \"brand_name\": \"\",\n      \"match_accuracy\": 100,\n      \"eaten\": {\n        \"singular_description\": \"cup\",\n        \"plural_description\": \"cups\",\n        \"units\": 0.5,\n        \"metric_description\": \"ml\",\n        \"per_unit_metric_amount\": 237,\n        \"total_metric_amount\": 118.5,\n        \"imperial_description\": \"fl oz\",\n        \"per_unit_imperial_amount\": 8,\n        \"total_imperial_amount\": 4\n      },\n      \"suggested_serving\": {\n        \"serving_id\": \"10299006\",\n        \"serving\": \"1 cup (237.000 g)\",\n        \"is_default\": 1,\n        \"serving_description\": \"1 cup\",\n        \"number_of_units\": 0.5\n      }\n    },\n    {\n      \"food_id\": 123456, // Assuming a food ID for \"small avocado\"\n      \"food_name\": \"Avocado\",\n      \"food_type\": \"Generic\",\n      \"brand_name\": \"\",\n      \"match_accuracy\": 90,\n      \"eaten\": {\n        \"singular_description\": \"avocado\",\n        \"plural_description\": \"avocados\",\n        \"units\": 1,\n        \"metric_description\": \"g\",\n        \"per_unit_metric_amount\": 136, // Average weight of a small avocado\n        \"total_metric_amount\": 136,\n        \"imperial_description\": \"oz\",\n        \"per_unit_imperial_amount\": 4.8, // Approximate imperial conversion\n        \"total_imperial_amount\": 4.8\n      },\n      \"suggested_serving\": {\n        \"serving_id\": \"some_id\", // Replace with actual serving ID if available\n        \"serving\": \"1 medium avocado\",\n        \"is_default\": 1,\n        \"serving_description\": \"1 medium\",\n        \"number_of_units\": 0.8 // Assuming a small avocado is 80% of a medium avocado\n      }\n    },\n    {\n      \"food_id\": 789012, // Assuming a food ID for \"keto bread\"\n      \"food_name\": \"Keto Bread\",\n      \"food_type\": \"Generic\",\n      \"brand_name\": \"\",\n      \"match_accuracy\": 80,\n      \"eaten\": {\n        \"singular_description\": \"slice\",\n        \"plural_description\": \"slices\",\n        \"units\": 1,\n        \"metric_description\": \"g\",\n        \"per_unit_metric_amount\": 30, // Approximate weight of a slice of keto bread\n        \"total_metric_amount\": 30,\n        \"imperial_description\": \"oz\",\n        \"per_unit_imperial_amount\": 1.06, // Approximate imperial conversion\n        \"total_imperial_amount\": 1.06\n      },\n      \"suggested_serving\": {\n        \"serving_id\": \"some_id\", // Replace with actual serving ID if available\n        \"serving\": \"1 slice\",\n        \"is_default\": 1,\n        \"serving_description\": \"1 slice\",\n        \"number_of_units\": 1\n      }\n    },\n    {\n      \"food_id\": 345678, // Assuming a food ID for \"sugar free strawberries jam\"\n      \"food_name\": \"Sugar Free Strawberries Jam\",\n      \"food_type\": \"Generic\",\n      \"brand_name\": \"\",\n      \"match_accuracy\": 85,\n      \"eaten\": {\n        \"singular_description\": \"serving\",\n        \"plural_description\": \"servings\",\n        \"units\": 1,\n        \"metric_description\": \"g\",\n        \"per_unit_metric_amount\": 15, // Approximate weight of a serving of jam\n        \"total_metric_amount\": 15,\n        \"imperial_description\": \"oz\",\n        \"per_unit_imperial_amount\": 0.53, // Approximate imperial conversion\n        \"total_imperial_amount\": 0.53\n      },\n      \"suggested_serving\": {\n        \"serving_id\": \"some_id\", // Replace with actual serving ID if available\n        \"serving\": \"1 tbsp\",\n        \"is_default\": 1,\n        \"serving_description\": \"1 tbsp\",\n        \"number_of_units\": 1\n      }\n    },\n    {\n      \"food_id\": 901234, // Assuming a food ID for \"lemon juice\"\n      \"food_name\": \"Lemon Juice\",\n      \"food_type\": \"Generic\",\n      \"brand_name\": \"\",\n      \"match_accuracy\": 90,\n      \"eaten\": {\n        \"singular_description\": \"cup\",\n        \"plural_description\": \"cups\",\n        \"units\": 0.25,\n        \"metric_description\": \"ml\",\n        \"per_unit_metric_amount\": 237,\n        \"total_metric_amount\": 59.25,\n        \"imperial_description\": \"fl oz\",\n        \"per_unit_imperial_amount\": 8,\n        \"total_imperial_amount\": 2\n      },\n      \"suggested_serving\": {\n        \"serving_id\": \"some_id\", // Replace with actual serving ID if available\n        \"serving\": \"1 cup\",\n        \"is_default\": 1,\n        \"serving_description\": \"1 cup\",\n        \"number_of_units\": 0.25\n      }\n    },\n    {\n      \"food_id\": 567890, // Assuming a food ID for \"chia seeds\"\n      \"food_name\": \"Chia Seeds\",\n      \"food_type\": \"Generic\",\n      \"brand_name\": \"\",\n      \"match_accuracy\": 95,\n      \"eaten\": {\n        \"singular_description\": \"tbsp\",\n        \"plural_description\": \"tbsp\",\n        \"units\": 1,\n        \"metric_description\": \"g\",\n        \"per_unit_metric_amount\": 15, // Approximate weight of 1 tbsp chia seeds\n        \"total_metric_amount\": 15,\n        \"imperial_description\": \"oz\",\n        \"per_unit_imperial_amount\": 0.53, // Approximate imperial conversion\n        \"total_imperial_amount\": 0.53\n      },\n      \"suggested_serving\": {\n        \"serving_id\": \"some_id\", // Replace with actual serving ID if available\n        \"serving\": \"1 tbsp\",\n        \"is_default\": 1,\n        \"serving_description\": \"1 tbsp\",\n        \"number_of_units\": 1\n      }\n    }\n  ]\n}\n```",
        "invocation_time": 5.303427696228027,
        "cost": 0.00174923
      }
    ],
    "ingredients": "```json\n{\n  \"input\": \"I small avocado, 1 keto bread with sugar free strawberries jam. 1/2 cup hot water with 1/4 lemon juice and 1 tbsp chia seeds\",\n  \"language\": \"en\",\n  \"region\": \"us\",\n  \"language_description\": \"English\",\n  \"region_description\": \"United States\",\n  \"query\": [\n    \"33398452\"\n  ],\n  \"ingredients\": [\n    {\n      \"food_id\": 33398452,\n      \"food_name\": \"Keto White Bread\",\n      \"food_type\": \"Brand\",\n      \"brand_name\": \"Franz\",\n      \"match_accuracy\": 90,\n      \"eaten\": {\n        \"singular_description\": \"slice\",\n        \"plural_description\": \"slices\",\n        \"units\": 1.0,\n        \"metric_description\": \"g\",\n        \"per_unit_metric_amount\": 30.0,\n        \"total_metric_amount\": 30.0,\n        \"imperial_description\": \"oz\",\n        \"per_unit_imperial_amount\": 1.058,\n        \"total_imperial_amount\": 1.058\n      },\n      \"suggested_serving\": {\n        \"serving_id\": \"30116468\",\n        \"serving\": \"1 slice (30.000 g)\",\n        \"is_default\": 1,\n        \"serving_description\": \"1 slice\",\n        \"number_of_units\": 1.0\n      }\n    },\n    {\n      \"food_id\": 12345678,\n      \"food_name\": \"Avocado\",\n      \"food_type\": \"Generic\",\n      \"brand_name\": \"\",\n      \"match_accuracy\": 80,\n      \"eaten\": {\n        \"singular_description\": \"avocado\",\n        \"plural_description\": \"avocados\",\n        \"units\": 1.0,\n        \"metric_description\": \"g\",\n        \"per_unit_metric_amount\": 136.0,\n        \"total_metric_amount\": 136.0,\n        \"imperial_description\": \"oz\",\n        \"per_unit_imperial_amount\": 4.8,\n        \"total_imperial_amount\": 4.8\n      },\n      \"suggested_serving\": {\n        \"serving_id\": \"9012345\",\n        \"serving\": \"1 medium (136g)\",\n        \"is_default\": 1,\n        \"serving_description\": \"1 medium\",\n        \"number_of_units\": 1.0\n      }\n    },\n    {\n      \"food_id\": 23456789,\n      \"food_name\": \"Hot Water\",\n      \"food_type\": \"Generic\",\n      \"brand_name\": \"\",\n      \"match_accuracy\": 95,\n      \"eaten\": {\n        \"singular_description\": \"cup\",\n        \"plural_description\": \"cups\",\n        \"units\": 0.5,\n        \"metric_description\": \"ml\",\n        \"per_unit_metric_amount\": 240.0,\n        \"total_metric_amount\": 120.0,\n        \"imperial_description\": \"fl oz\",\n        \"per_unit_imperial_amount\": 8.0,\n        \"total_imperial_amount\": 4.0\n      },\n      \"suggested_serving\": {\n        \"serving_id\": \"7890123\",\n        \"serving\": \"1 cup (240ml)\",\n        \"is_default\": 1,\n        \"serving_description\": \"1 cup\",\n        \"number_of_units\": 0.5\n      }\n    },\n    {\n      \"food_id\": 34567890,\n      \"food_name\": \"Lemon Juice\",\n      \"food_type\": \"Generic\",\n      \"brand_name\": \"\",\n      \"match_accuracy\": 85,\n      \"eaten\": {\n        \"singular_description\": \"quarter\",\n        \"plural_description\": \"quarters\",\n        \"units\": 0.25,\n        \"metric_description\": \"ml\",\n        \"per_unit_metric_amount\": 60.0,\n        \"total_metric_amount\": 15.0,\n        \"imperial_description\": \"fl oz\",\n        \"per_unit_imperial_amount\": 2.0,\n        \"total_imperial_amount\": 0.5\n      },\n      \"suggested_serving\": {\n        \"serving_id\": \"4567890\",\n        \"serving\": \"1/4 cup (60ml)\",\n        \"is_default\": 0,\n        \"serving_description\": \"1/4 cup\",\n        \"number_of_units\": 0.25\n      }\n    },\n    {\n      \"food_id\": 45678901,\n      \"food_name\": \"Chia Seeds\",\n      \"food_type\": \"Generic\",\n      \"brand_name\": \"\",\n      \"match_accuracy\": 90,\n      \"eaten\": {\n        \"singular_description\": \"tablespoon\",\n        \"plural_description\": \"tablespoons\",\n        \"units\": 1.0,\n        \"metric_description\": \"g\",\n        \"per_unit_metric_amount\": 15.0,\n        \"total_metric_amount\": 15.0,\n        \"imperial_description\": \"oz\",\n        \"per_unit_imperial_amount\": 0.53,\n        \"total_imperial_amount\": 0.53\n      },\n      \"suggested_serving\": {\n        \"serving_id\": \"5678901\",\n        \"serving\": \"1 tbsp (15g)\",\n        \"is_default\": 1,\n        \"serving_description\": \"1 tbsp\",\n        \"number_of_units\": 1.0\n      }\n    }\n  ]\n}\n``` {\n    \"input\": \"I small avocado, 1 keto bread with sugar free strawberries jam. 1/2 cup hot water with 1/4 lemon juice and 1 tbsp chia seeds\",\n    \"language\": \"en\",\n    \"region\": \"us\",\n    \"language_description\": \"English\",\n    \"region_description\": \"United States\",\n    \"query\": [\n        35752,\n        1000000000000\n    ],\n    \"ingredients\": [\n        {\n            \"food_id\": 35752,\n            \"food_name\": \"Avocados\",\n            \"food_type\": \"Generic\",\n            \"brand_name\": \"\",\n            \"match_accuracy\": 100,\n            \"eaten\": {\n                \"singular_description\": \"avocado\",\n                \"plural_description\": \"avocados\",\n                \"units\": 1,\n                \"metric_description\": \"g\",\n                \"per_unit_metric_amount\": 150,\n                \"total_metric_amount\": 150,\n                \"imperial_description\": \"oz\",\n                \"per_unit_imperial_amount\": 5.291,\n                \"total_imperial_amount\": 5.291\n            },\n            \"suggested_serving\": {\n                \"serving_id\": \"58483\",\n                \"serving\": \"100 g (100.000 g)\",\n                \"is_default\": 1,\n                \"serving_description\": \"100 g\",\n                \"number_of_units\": 1\n            }\n        },\n        {\n            \"food_id\": 1000000000000,\n            \"food_name\": \"Bread, white, commercially prepared\",\n            \"food_type\": \"Generic\",\n            \"brand_name\": \"\",\n            \"match_accuracy\": 90,\n            \"eaten\": {\n                \"singular_description\": \"slice\",\n                \"plural_description\": \"slices\",\n                \"units\": 1,\n                \"metric_description\": \"g\",\n                \"per_unit_metric_amount\": 28,\n                \"total_metric_amount\": 28,\n                \"imperial_description\": \"oz\",\n                \"per_unit_imperial_amount\": 1,\n                \"total_imperial_amount\": 1\n            },\n            \"suggested_serving\": {\n                \"serving_id\": \"43671\",\n                \"serving\": \"1 oz (28.350 g)\",\n                \"is_default\": 0,\n                \"serving_description\": \"1 oz\",\n                \"number_of_units\": 1\n            }\n        },\n        {\n            \"food_id\": 1000000000000,\n            \"food_name\": \"Jam, strawberries, sugar free\",\n            \"food_type\": \"Generic\",\n            \"brand_name\": \"\",\n            \"match_accuracy\": 90,\n            \"eaten\": {\n                \"singular_description\": \"tbsp\",\n                \"plural_description\": \"tbsps\",\n                \"units\": 1,\n                \"metric_description\": \"g\",\n                \"per_unit_metric_amount\": 20,\n                \"total_metric_amount\": 20,\n                \"imperial_description\": \"oz\",\n                \"per_unit_imperial_amount\": 0.705,\n                \"total_imperial_amount\": 0.705\n            },\n            \"suggested_serving\": {\n                \"serving_id\": \"43671\",\n                \"serving\": \"1 oz (28.350 g)\",\n                \"is_default\": 0,\n                \"serving_description\": \"1 oz\",\n                \"number_of_units\": 1\n            }\n        },\n        {\n            \"food_id\": 1000000000000,\n            \"food_name\": \"Water\",\n            \"food_type\": \"Generic\",\n            \"brand_name\": \"\",\n            \"match_accuracy\": 100,\n            \"eaten\": {\n                \"singular_description\": \"cup\",\n                \"plural_description\": \"cups\",\n                \"units\": 0.5,\n                \"metric_description\": \"ml\",\n                \"per_unit_metric_amount\": 236.588,\n                \"total_metric_amount\": 118.294,\n                \"imperial_description\": \"fl oz\",\n                \"per_unit_imperial_amount\": 8.453,\n                \"total_imperial_amount\": 4.2265\n            },\n            \"suggested_serving\": {\n                \"serving_id\": \"43671\",\n                \"serving\": \"1 cup (236.588 ml)\",\n                \"is_default\": 1,\n                \"serving_description\": \"1 cup\",\n                \"number_of_units\": 0.5\n            }\n        },\n        {\n            \"food_id\": 1000000000000,\n            \"food_name\": \"Lemon juice\",\n            \"food_type\": \"Generic\",\n            \"brand_name\": \"\",\n            \"match_accuracy\": 90,\n            \"eaten\": {\n                \"singular_description\": \"tbsp\",\n                \"plural_description\": \"tbsps\",\n                \"units\": 0.25,\n                \"metric_description\": \"ml\",\n                \"per_unit_metric_amount\": 15,\n                \"total_metric_amount\": 3.75,\n                \"imperial_description\": \"fl oz\",\n                \"per_unit_imperial_amount\": 0.125,\n                \"total_imperial_amount\": 0.3125\n            },\n            \"suggested_serving\": {\n                \"serving_id\": \"43671\",\n                \"serving\": \"1 tbsp (15 ml)\",\n                \"is_default\": 0,\n                \"serving_description\": \"1 tbsp\",\n                \"number_of_units\": 0.25\n            }\n        },\n        {\n            \"food_id\": 1000000000000,\n            \"food_name\": \"Chia seeds\",\n            \"food_type\": \"Generic\",\n            \"brand_name\": \"\",\n            \"match_accuracy\": 90,\n            \"eaten\": {\n                \"singular_description\": \"tbsp\",\n                \"plural_description\": \"tbsps\",\n                \"units\": 1,\n                \"metric_description\": \"g\",\n                \"per_unit_metric_amount\": 12,\n                \"total_metric_amount\": 12,\n                \"imperial_description\": \"oz\",\n                \"per_unit_imperial_amount\": 0.423,\n                \"total_imperial_amount\": 0.423\n            },\n            \"suggested_serving\": {\n                \"serving_id\": \"43671\",\n                \"serving\": \"1 tbsp (12 g)\",\n                \"is_default\": 0,\n                \"serving_description\": \"1 tbsp\",\n                \"number_of_units\": 1\n            }\n        }\n    ]\n} {\n  \"input\": \"I small avocado, 1 keto bread with sugar free strawberries jam. 1/2 cup hot water with 1/4 lemon juice and 1 tbsp chia seeds\",\n  \"language\": \"en\",\n  \"region\": \"us\",\n  \"language_description\": \"English\",\n  \"region_description\": \"United States\",\n  \"query\": [\n    \"1328288\"\n  ],\n  \"ingredients\": [\n    {\n      \"food_id\": 1328288,\n      \"food_name\": \"Chia Seeds\",\n      \"food_type\": \"Brand\",\n      \"brand_name\": \"Spectrum\",\n      \"match_accuracy\": 100,\n      \"eaten\": {\n        \"singular_description\": \"tbsp\",\n        \"plural_description\": \"tbsp\",\n        \"units\": 1,\n        \"metric_description\": \"g\",\n        \"per_unit_metric_amount\": 12,\n        \"total_metric_amount\": 12,\n        \"imperial_description\": \"oz\",\n        \"per_unit_imperial_amount\": 0.4,\n        \"total_imperial_amount\": 0.4\n      },\n      \"suggested_serving\": {\n        \"serving_id\": \"1319171\",\n        \"serving\": \"1 tbsp\",\n        \"is_default\": 1,\n        \"serving_description\": \"1 tbsp\",\n        \"number_of_units\": 1\n      }\n    }\n  ]\n} {\n    \"input\": \"I small avocado, 1 keto bread with sugar free strawberries jam. 1/2 cup hot water with 1/4 lemon juice and 1 tbsp chia seeds\",\n    \"language\": \"en\",\n    \"region\": \"us\",\n    \"language_description\": \"English\",\n    \"region_description\": \"United States\",\n    \"query\": [\n        35849\n    ],\n    \"ingredients\": [\n        {\n            \"food_id\": 35849,\n            \"food_name\": \"Lemon Juice\",\n            \"food_type\": \"Generic\",\n            \"brand_name\": \"\",\n            \"match_accuracy\": 100,\n            \"eaten\": {\n                \"singular_description\": \"fl oz\",\n                \"plural_description\": \"fl oz\",\n                \"units\": 0.25,\n                \"metric_description\": \"ml\",\n                \"per_unit_metric_amount\": 30.5,\n                \"total_metric_amount\": 7.625,\n                \"imperial_description\": \"fl oz\",\n                \"per_unit_imperial_amount\": 1,\n                \"total_imperial_amount\": 0.25\n            },\n            \"suggested_serving\": {\n                \"serving_id\": \"33133\",\n                \"serving\": \"1 fl oz (30.500 g)\",\n                \"is_default\": 1,\n                \"serving_description\": \"1 fl oz\",\n                \"number_of_units\": 0.25\n            }\n        }\n    ]\n} {\n  \"input\": \"I small avocado, 1 keto bread with sugar free strawberries jam. 1/2 cup hot water with 1/4 lemon juice and 1 tbsp chia seeds\",\n  \"language\": \"en\",\n  \"region\": \"us\",\n  \"language_description\": \"English\",\n  \"region_description\": \"United States\",\n  \"query\": [\n    \"5526\"\n  ],\n  \"ingredients\": [\n    {\n      \"food_id\": 5526,\n      \"food_name\": \"Strawberries with Sugar\",\n      \"food_type\": \"Generic\",\n      \"brand_name\": \"\",\n      \"match_accuracy\": 100,\n      \"eaten\": {\n        \"singular_description\": \"slice\",\n        \"plural_description\": \"slices\",\n        \"units\": 0.25,\n        \"metric_description\": \"g\",\n        \"per_unit_metric_amount\": 100,\n        \"total_metric_amount\": 25,\n        \"imperial_description\": \"oz\",\n        \"per_unit_imperial_amount\": 3.5274,\n        \"total_imperial_amount\": 0.88185\n      },\n      \"suggested_serving\": {\n        \"serving_id\": \"54206\",\n        \"serving\": \"100 g\",\n        \"is_default\": 0,\n        \"serving_description\": \"100 g\",\n        \"number_of_units\": 0.25\n      }\n    },\n    {\n      \"food_id\": 0,\n      \"food_name\": \"Avocado\",\n      \"food_type\": \"Generic\",\n      \"brand_name\": \"\",\n      \"match_accuracy\": 100,\n      \"eaten\": {\n        \"singular_description\": \"small\",\n        \"plural_description\": \"small\",\n        \"units\": 0.25,\n        \"metric_description\": \"g\",\n        \"per_unit_metric_amount\": 160,\n        \"total_metric_amount\": 40,\n        \"imperial_description\": \"oz\",\n        \"per_unit_imperial_amount\": 5.6,\n        \"total_imperial_amount\": 1.4\n      },\n      \"suggested_serving\": {\n        \"serving_id\": \"\",\n        \"serving\": \"small\",\n        \"is_default\": 0,\n        \"serving_description\": \"small\",\n        \"number_of_units\": 0.25\n      }\n    },\n    {\n      \"food_id\": 0,\n      \"food_name\": \"Keto Bread\",\n      \"food_type\": \"Generic\",\n      \"brand_name\": \"\",\n      \"match_accuracy\": 100,\n      \"eaten\": {\n        \"singular_description\": \"piece\",\n        \"plural_description\": \"pieces\",\n        \"units\": 1,\n        \"metric_description\": \"g\",\n        \"per_unit_metric_amount\": 70,\n        \"total_metric_amount\": 70,\n        \"imperial_description\": \"oz\",\n        \"per_unit_imperial_amount\": 2.45,\n        \"total_imperial_amount\": 2.45\n      },\n      \"suggested_serving\": {\n        \"serving_id\": \"\",\n        \"serving\": \"piece\",\n        \"is_default\": 0,\n        \"serving_description\": \"piece\",\n        \"number_of_units\": 1\n      }\n    },\n    {\n      \"food_id\": 0,\n      \"food_name\": \"Lemon Juice\",\n      \"food_type\": \"Generic\",\n      \"brand_name\": \"\",\n      \"match_accuracy\": 100,\n      \"eaten\": {\n        \"singular_description\": \"cup\",\n        \"plural_description\": \"cups\",\n        \"units\": 0.5,\n        \"metric_description\": \"ml\",\n        \"per_unit_metric_amount\": 240,\n        \"total_metric_amount\": 120,\n        \"imperial_description\": \"fl oz\",\n        \"per_unit_imperial_amount\": 8,\n        \"total_imperial_amount\": 4\n      },\n      \"suggested_serving\": {\n        \"serving_id\": \"\",\n        \"serving\": \"1/2 cup\",\n        \"is_default\": 0,\n        \"serving_description\": \"1/2 cup\",\n        \"number_of_units\": 0.5\n      }\n    },\n    {\n      \"food_id\": 0,\n      \"food_name\": \"Chia Seeds\",\n      \"food_type\": \"Generic\",\n      \"brand_name\": \"\",\n      \"match_accuracy\": 100,\n      \"eaten\": {\n        \"singular_description\": \"tbsp\",\n        \"plural_description\": \"tbsps\",\n        \"units\": 1,\n        \"metric_description\": \"g\",\n        \"per_unit_metric_amount\": 12,\n        \"total_metric_amount\": 12,\n        \"imperial_description\": \"oz\",\n        \"per_unit_imperial_amount\": 0.42,\n        \"total_imperial_amount\": 0.42\n      },\n      \"suggested_serving\": {\n        \"serving_id\": \"\",\n        \"serving\": \"1 tbsp\",\n        \"is_default\": 0,\n        \"serving_description\": \"1 tbsp\",\n        \"number_of_units\": 1\n      }\n    }\n  ]\n} ```json\n{\n  \"input\": \"I small avocado, 1 keto bread with sugar free strawberries jam. 1/2 cup hot water with 1/4 lemon juice and 1 tbsp chia seeds\",\n  \"language\": \"en\",\n  \"region\": \"us\",\n  \"language_description\": \"English\",\n  \"region_description\": \"United States\",\n  \"query\": [\n    \"10811554\"\n  ],\n  \"ingredients\": [\n    {\n      \"food_id\": 10811554,\n      \"food_name\": \"Hot Water\",\n      \"food_type\": \"Generic\",\n      \"brand_name\": \"\",\n      \"match_accuracy\": 100,\n      \"eaten\": {\n        \"singular_description\": \"cup\",\n        \"plural_description\": \"cups\",\n        \"units\": 0.5,\n        \"metric_description\": \"ml\",\n        \"per_unit_metric_amount\": 237,\n        \"total_metric_amount\": 118.5,\n        \"imperial_description\": \"fl oz\",\n        \"per_unit_imperial_amount\": 8,\n        \"total_imperial_amount\": 4\n      },\n      \"suggested_serving\": {\n        \"serving_id\": \"10299006\",\n        \"serving\": \"1 cup (237.000 g)\",\n        \"is_default\": 1,\n        \"serving_description\": \"1 cup\",\n        \"number_of_units\": 0.5\n      }\n    },\n    {\n      \"food_id\": 123456, // Assuming a food ID for \"small avocado\"\n      \"food_name\": \"Avocado\",\n      \"food_type\": \"Generic\",\n      \"brand_name\": \"\",\n      \"match_accuracy\": 90,\n      \"eaten\": {\n        \"singular_description\": \"avocado\",\n        \"plural_description\": \"avocados\",\n        \"units\": 1,\n        \"metric_description\": \"g\",\n        \"per_unit_metric_amount\": 136, // Average weight of a small avocado\n        \"total_metric_amount\": 136,\n        \"imperial_description\": \"oz\",\n        \"per_unit_imperial_amount\": 4.8, // Approximate imperial conversion\n        \"total_imperial_amount\": 4.8\n      },\n      \"suggested_serving\": {\n        \"serving_id\": \"some_id\", // Replace with actual serving ID if available\n        \"serving\": \"1 medium avocado\",\n        \"is_default\": 1,\n        \"serving_description\": \"1 medium\",\n        \"number_of_units\": 0.8 // Assuming a small avocado is 80% of a medium avocado\n      }\n    },\n    {\n      \"food_id\": 789012, // Assuming a food ID for \"keto bread\"\n      \"food_name\": \"Keto Bread\",\n      \"food_type\": \"Generic\",\n      \"brand_name\": \"\",\n      \"match_accuracy\": 80,\n      \"eaten\": {\n        \"singular_description\": \"slice\",\n        \"plural_description\": \"slices\",\n        \"units\": 1,\n        \"metric_description\": \"g\",\n        \"per_unit_metric_amount\": 30, // Approximate weight of a slice of keto bread\n        \"total_metric_amount\": 30,\n        \"imperial_description\": \"oz\",\n        \"per_unit_imperial_amount\": 1.06, // Approximate imperial conversion\n        \"total_imperial_amount\": 1.06\n      },\n      \"suggested_serving\": {\n        \"serving_id\": \"some_id\", // Replace with actual serving ID if available\n        \"serving\": \"1 slice\",\n        \"is_default\": 1,\n        \"serving_description\": \"1 slice\",\n        \"number_of_units\": 1\n      }\n    },\n    {\n      \"food_id\": 345678, // Assuming a food ID for \"sugar free strawberries jam\"\n      \"food_name\": \"Sugar Free Strawberries Jam\",\n      \"food_type\": \"Generic\",\n      \"brand_name\": \"\",\n      \"match_accuracy\": 85,\n      \"eaten\": {\n        \"singular_description\": \"serving\",\n        \"plural_description\": \"servings\",\n        \"units\": 1,\n        \"metric_description\": \"g\",\n        \"per_unit_metric_amount\": 15, // Approximate weight of a serving of jam\n        \"total_metric_amount\": 15,\n        \"imperial_description\": \"oz\",\n        \"per_unit_imperial_amount\": 0.53, // Approximate imperial conversion\n        \"total_imperial_amount\": 0.53\n      },\n      \"suggested_serving\": {\n        \"serving_id\": \"some_id\", // Replace with actual serving ID if available\n        \"serving\": \"1 tbsp\",\n        \"is_default\": 1,\n        \"serving_description\": \"1 tbsp\",\n        \"number_of_units\": 1\n      }\n    },\n    {\n      \"food_id\": 901234, // Assuming a food ID for \"lemon juice\"\n      \"food_name\": \"Lemon Juice\",\n      \"food_type\": \"Generic\",\n      \"brand_name\": \"\",\n      \"match_accuracy\": 90,\n      \"eaten\": {\n        \"singular_description\": \"cup\",\n        \"plural_description\": \"cups\",\n        \"units\": 0.25,\n        \"metric_description\": \"ml\",\n        \"per_unit_metric_amount\": 237,\n        \"total_metric_amount\": 59.25,\n        \"imperial_description\": \"fl oz\",\n        \"per_unit_imperial_amount\": 8,\n        \"total_imperial_amount\": 2\n      },\n      \"suggested_serving\": {\n        \"serving_id\": \"some_id\", // Replace with actual serving ID if available\n        \"serving\": \"1 cup\",\n        \"is_default\": 1,\n        \"serving_description\": \"1 cup\",\n        \"number_of_units\": 0.25\n      }\n    },\n    {\n      \"food_id\": 567890, // Assuming a food ID for \"chia seeds\"\n      \"food_name\": \"Chia Seeds\",\n      \"food_type\": \"Generic\",\n      \"brand_name\": \"\",\n      \"match_accuracy\": 95,\n      \"eaten\": {\n        \"singular_description\": \"tbsp\",\n        \"plural_description\": \"tbsp\",\n        \"units\": 1,\n        \"metric_description\": \"g\",\n        \"per_unit_metric_amount\": 15, // Approximate weight of 1 tbsp chia seeds\n        \"total_metric_amount\": 15,\n        \"imperial_description\": \"oz\",\n        \"per_unit_imperial_amount\": 0.53, // Approximate imperial conversion\n        \"total_imperial_amount\": 0.53\n      },\n      \"suggested_serving\": {\n        \"serving_id\": \"some_id\", // Replace with actual serving ID if available\n        \"serving\": \"1 tbsp\",\n        \"is_default\": 1,\n        \"serving_description\": \"1 tbsp\",\n        \"number_of_units\": 1\n      }\n    }\n  ]\n}\n```",
    "total_cost": 0.00801026
  },
  {
    "row_index": 1,
    "total_time": 4.7788660526275635,
    "food_count": 7,
    "individual_results": [
      {
        "food_query": 39866,
        "model_id": "us.meta.llama4-maverick-17b-instruct-v1:0",
        "actual": "```json\n{\n  \"input\": \"\u042f \u0435\u043b\u0430 \u044f\u0438\u0447\u043d\u0438\u0446\u0443 \u0438\u0437 \u0434\u0432\u0443\u0445 \u044f\u0438\u0446 \u043f\u043e\u0441\u044b\u043f\u0430\u043d\u043d\u0443\u044e \u0441\u043e\u043b\u044c\u044e \u0441 \u0442\u0440\u0430\u0432\u0430\u043c\u0438 \u043e\u0434\u0438\u043d \u043b\u043e\u043c\u0442\u0438\u043a \u0440\u0438\u0441\u043e\u0432\u044b\u0439 \u0445\u043b\u0435\u0431 \u0441 \u0442\u0432\u043e\u0440\u043e\u0436\u043d\u044b\u043c \u0441\u044b\u0440\u043e\u043c \u0438 \u043a\u043e\u0444\u0435 \u0441 \u0441\u0430\u0445\u0430\u0440\u043e\u043c \u0438 \u0441\u043b\u0438\u0432\u043a\u0430\u043c\u0438\",\n  \"language\": \"ru\",\n  \"region\": \"ru\",\n  \"language_description\": \"russian\",\n  \"region_description\": \"russia\",\n  \"query\": [\n    \"39866\"\n  ],\n  \"ingredients\": [\n    {\n      \"food_id\": 39866,\n      \"food_name\": \"\u042f\u0438\u0447\u043d\u0438\u0446\u0430\",\n      \"food_type\": \"Generic\",\n      \"brand_name\": \"\",\n      \"match_accuracy\": 100,\n      \"eaten\": {\n        \"singular_description\": \"\u044f\u0439\u0446\u043e\",\n        \"plural_description\": \"\u044f\u0439\u0446\u0430\",\n        \"units\": 2,\n        \"metric_description\": \"g\",\n        \"per_unit_metric_amount\": 47,\n        \"total_metric_amount\": 94,\n        \"imperial_description\": \"oz\",\n        \"per_unit_imperial_amount\": 1.66,\n        \"total_imperial_amount\": 3.32\n      },\n      \"suggested_serving\": {\n        \"serving_id\": \"40472\",\n        \"serving\": \"2 \u044f\u0439\u0446\u0430 (94.000 \u0433)\",\n        \"is_default\": 1,\n        \"serving_description\": \"2 \u044f\u0439\u0446\u0430\",\n        \"number_of_units\": 1\n      }\n    },\n    {\n      \"food_id\": null,\n      \"food_name\": \"\u0441\u043e\u043b\u044c\",\n      \"food_type\": null,\n      \"brand_name\": \"\",\n      \"match_accuracy\": null,\n      \"eaten\": {\n        \"singular_description\": \"\",\n        \"plural_description\": \"\",\n        \"units\": 1,\n        \"metric_description\": \"g\",\n        \"per_unit_metric_amount\": null,\n        \"total_metric_amount\": null,\n        \"imperial_description\": \"oz\",\n        \"per_unit_imperial_amount\": null,\n        \"total_imperial_amount\": null\n      },\n      \"suggested_serving\": {\n        \"serving_id\": null,\n        \"serving\": null,\n        \"is_default\": null,\n        \"serving_description\": null,\n        \"number_of_units\": null\n      }\n    },\n    {\n      \"food_id\": null,\n      \"food_name\": \"\u0442\u0440\u0430\u0432\u044b\",\n      \"food_type\": null,\n      \"brand_name\": \"\",\n      \"match_accuracy\": null,\n      \"eaten\": {\n        \"singular_description\": \"\",\n        \"plural_description\": \"\",\n        \"units\": 1,\n        \"metric_description\": \"g\",\n        \"per_unit_metric_amount\": null,\n        \"total_metric_amount\": null,\n        \"imperial_description\": \"oz\",\n        \"per_unit_imperial_amount\": null,\n        \"total_imperial_amount\": null\n      },\n      \"suggested_serving\": {\n        \"serving_id\": null,\n        \"serving\": null,\n        \"is_default\": null,\n        \"serving_description\": null,\n        \"number_of_units\": null\n      }\n    },\n    {\n      \"food_id\": null,\n      \"food_name\": \"\u043b\u043e\u043c\u0442\u0438\u043a \u0440\u0438\u0441\u043e\u0432\u044b\u0439 \u0445\u043b\u0435\u0431\",\n      \"food_type\": null,\n      \"brand_name\": \"\",\n      \"match_accuracy\": null,\n      \"eaten\": {\n        \"singular_description\": \"\u043b\u043e\u043c\u0442\u0438\u043a\",\n        \"plural_description\": \"\u043b\u043e\u043c\u0442\u0438\u043a\u0438\",\n        \"units\": 1,\n        \"metric_description\": \"g\",\n        \"per_unit_metric_amount\": null,\n        \"total_metric_amount\": null,\n        \"imperial_description\": \"oz\",\n        \"per_unit_imperial_amount\": null,\n        \"total_imperial_amount\": null\n      },\n      \"suggested_serving\": {\n        \"serving_id\": null,\n        \"serving\": null,\n        \"is_default\": null,\n        \"serving_description\": null,\n        \"number_of_units\": null\n      }\n    },\n    {\n      \"food_id\": null,\n      \"food_name\": \"\u0442\u0432\u043e\u0440\u043e\u0436\u043d\u044b\u0439 \u0441\u044b\u0440\",\n      \"food_type\": null,\n      \"brand_name\": \"\",\n      \"match_accuracy\": null,\n      \"eaten\": {\n        \"singular_description\": \"\",\n        \"plural_description\": \"\",\n        \"units\": 1,\n        \"metric_description\": \"g\",\n        \"per_unit_metric_amount\": null,\n        \"total_metric_amount\": null,\n        \"imperial_description\": \"oz\",\n        \"per_unit_imperial_amount\": null,\n        \"total_imperial_amount\": null\n      },\n      \"suggested_serving\": {\n        \"serving_id\": null,\n        \"serving\": null,\n        \"is_default\": null,\n        \"serving_description\": null,\n        \"number_of_units\": null\n      }\n    },\n    {\n      \"food_id\": null,\n      \"food_name\": \"\u043a\u043e\u0444\u0435\",\n      \"food_type\": null,\n      \"brand_name\": \"\",\n      \"match_accuracy\": null,\n      \"eaten\": {\n        \"singular_description\": \"\",\n        \"plural_description\": \"\",\n        \"units\": 1,\n        \"metric_description\": \"ml\",\n        \"per_unit_metric_amount\": null,\n        \"total_metric_amount\": null,\n        \"imperial_description\": \"fl oz\",\n        \"per_unit_imperial_amount\": null,\n        \"total_imperial_amount\": null\n      },\n      \"suggested_serving\": {\n        \"serving_id\": null,\n        \"serving\": null,\n        \"is_default\": null,\n        \"serving_description\": null,\n        \"number_of_units\": null\n      }\n    },\n    {\n      \"food_id\": null,\n      \"food_name\": \"\u0441\u0430\u0445\u0430\u0440\",\n      \"food_type\": null,\n      \"brand_name\": \"\",\n      \"match_accuracy\": null,\n      \"eaten\": {\n        \"singular_description\": \"\",\n        \"plural_description\": \"\",\n        \"units\": 1,\n        \"metric_description\": \"g\",\n        \"per_unit_metric_amount\": null,\n        \"total_metric_amount\": null,\n        \"imperial_description\": \"oz\",\n        \"per_unit_imperial_amount\": null,\n        \"total_imperial_amount\": null\n      },\n      \"suggested_serving\": {\n        \"serving_id\": null,\n        \"serving\": null,\n        \"is_default\": null,\n        \"serving_description\": null,\n        \"number_of_units\": null\n      }\n    },\n    {\n      \"food_id\": null,\n      \"food_name\": \"\u0441\u043b\u0438\u0432\u043a\u0438\",\n      \"food_type\": null,\n      \"brand_name\": \"\",\n      \"match_accuracy\": null,\n      \"eaten\": {\n        \"singular_description\": \"\",\n        \"plural_description\": \"\",\n        \"units\": 1,\n        \"metric_description\": \"ml\",\n        \"per_unit_metric_amount\": null,\n        \"total_metric_amount\": null,\n        \"imperial_description\": \"fl oz\",\n        \"per_unit_imperial_amount\": null,\n        \"total_imperial_amount\": null\n      },\n      \"suggested_serving\": {\n        \"serving_id\": null,\n        \"serving\": null,\n        \"is_default\": null,\n        \"serving_description\": null,\n        \"number_of_units\": null\n      }\n    }\n  ]\n}\n```",
        "invocation_time": 4.570877313613892,
        "cost": 0.00186201
      },
      {
        "food_query": 7397074,
        "model_id": "us.amazon.nova-lite-v1:0",
        "actual": "{\n    \"input\": \"\u044f \u0435\u043b \u044f\u0438\u0447\u043d\u0438\u0446\u0443 \u0438\u0437 \u0434\u0432\u0443\u0445 \u044f\u0438\u0446 \u043f\u043e\u0441\u044b\u043f\u0430\u043d\u043d\u0443\u044e \u0441\u043e\u043b\u044c\u044e \u0438 \u0442\u0440\u0430\u0432\u0430\u043c\u0438 \u043e\u0434\u043d\u0438\u043c \u043b\u043e\u043c\u0442\u0438\u043a\u043e\u043c \u0440\u0438\u0441\u043e\u0432\u043e\u0433\u043e \u0445\u043b\u0435\u0431\u0430 \u0441 \u0442\u043e\u043c\u0430\u0442\u043d\u044b\u043c \u0441\u043e\u0443\u0441\u043e\u043c \u0438 \u043a\u043e\u0444\u0435 \u0441 \u0441\u0430\u0445\u0430\u0440\u043e\u043c\",\n    \"language\": \"ru\",\n    \"region\": \"ru\",\n    \"language_description\": \"russian\",\n    \"region_description\": \"russia\",\n    \"query\": [\n        7397074\n    ],\n    \"ingredients\": [\n        {\n            \"food_id\": 7397074,\n            \"food_name\": \"\u041f\u0440\u043e\u0432\u0430\u043d\u0441\u043a\u0438\u0435 \u0422\u0440\u0430\u0432\u044b\",\n            \"food_type\": \"Brand\",\n            \"brand_name\": \"Kamis\",\n            \"match_accuracy\": 100,\n            \"eaten\": {\n                \"singular_description\": \"\u043f\u0440\u044b\u0449\",\n                \"plural_description\": \"\u043f\u0440\u044b\u0449\u0438\",\n                \"units\": 1,\n                \"metric_description\": \"g\",\n                \"per_unit_metric_amount\": 10,\n                \"total_metric_amount\": 10,\n                \"imperial_description\": \"oz\",\n                \"per_unit_imperial_amount\": 0.35274,\n                \"total_imperial_amount\": 0.35274\n            },\n            \"suggested_serving\": {\n                \"serving_id\": \"7133790\",\n                \"serving\": \"100\u0433 (100.000 \u0433)\",\n                \"is_default\": 1,\n                \"serving_description\": \"100\u0433\",\n                \"number_of_units\": 1\n            }\n        }\n    ]\n}",
        "invocation_time": 2.0299315452575684,
        "cost": 0.00087038
      },
      {
        "food_query": 33908,
        "model_id": "us.amazon.nova-micro-v1:0",
        "actual": "{\n  \"input\": \"\u042f \u0435\u043b\u0430 \u044f\u0438\u0447\u043d\u0438\u0446\u0443 \u0438\u0437 \u0434\u0432\u0443\u0445 \u044f\u0438\u0446 \u0441 \u0440\u0438\u0441\u043e\u043c \u0438 \u0441\u044b\u0440\u043e\u043c \u0441 \u0442\u043e\u0441\u0442\u043e\u043c \u043e\u0434\u043d\u0443 \u043b\u043e\u0436\u043a\u0443 \u0440\u0438\u0441\u043e\u0432\u043e\u0433\u043e \u0445\u043b\u0435\u0431\u0430 \u0441 \u0441\u044b\u0440\u043e\u043c \u0438 \u043a\u043e\u043b\u0431\u0430\u0441\u043e\u0439 \u0441 \u0441\u0430\u0445\u0430\u0440\u043e\u043c \u0438 \u0441\u043b\u0438\u0432\u043a\u0430\u043c\u0438\",\n  \"language\": \"ru\",\n  \"region\": \"ru\",\n  \"language_description\": \"russian\",\n  \"region_description\": \"russia\",\n  \"include_servings\": \"defaultAndGrams\",\n  \"query\": [\n    33908\n  ],\n  \"ingredients\": [\n    {\n      \"food_id\": 33908,\n      \"food_name\": \"\u0421\u043e\u043b\u044c\",\n      \"food_type\": \"Generic\",\n      \"brand_name\": \"\",\n      \"match_accuracy\": 100,\n      \"eaten\": {\n        \"singular_description\": \"\u0433\u0440\u0430\u043c\u043c\",\n        \"plural_description\": \"\u0433\u0440\u0430\u043c\u043c\",\n        \"units\": 0.4,\n        \"metric_description\": \"g\",\n        \"per_unit_metric_amount\": 0.4,\n        \"total_metric_amount\": 0.4,\n        \"imperial_description\": \"oz\",\n        \"per_unit_imperial_amount\": 0.0141748,\n        \"total_imperial_amount\": 0.0057099\n      },\n      \"suggested_serving\": {\n        \"serving_id\": \"29654\",\n        \"serving\": \"1 \u043d\u0435\u0431\u043e\u043b\u044c\u0448\u0430\u044f \u0447\u0430\u0439\u043d\u0430\u044f \u043b\u043e\u0436\u043a\u0430 (0.400 \u0433)\",\n        \"is_default\": 1,\n        \"serving_description\": \"1 \u043d\u0435\u0431\u043e\u043b\u044c\u0448\u0430\u044f \u0447\u0430\u0439\u043d\u0430\u044f \u043b\u043e\u0436\u043a\u0430\",\n        \"number_of_units\": 0.4\n      }\n    }\n  ]\n}",
        "invocation_time": 2.170771598815918,
        "cost": 0.0009196200000000001
      },
      {
        "food_query": 7175,
        "model_id": "us.amazon.nova-lite-v1:0",
        "actual": "{\n    \"input\": \"\u044f \u0435\u043b \u044f\u0438\u0447\u043d\u0438\u0446\u0443 \u0438\u0437 \u0434\u0432\u0443\u0445 \u044f\u0438\u0446 \u043f\u043e\u0441\u044b\u043f\u0430\u043d\u043d\u0443\u044e \u0441\u043e\u043b\u044c\u044e \u0438 \u0442\u0440\u0430\u0432\u0430\u043c\u0438 \u043e\u0434\u043d\u0438\u043c \u043b\u043e\u043c\u0442\u0438\u043a\u043e\u043c \u0440\u0438\u0441\u043e\u0432\u043e\u0433\u043e \u0445\u043b\u0435\u0431\u0430 \u0441 \u0442\u043e\u043c\u0430\u0442\u043d\u044b\u043c \u0441\u043e\u0443\u0441\u043e\u043c \u0438 \u043a\u043e\u0444\u0435 \u0441 \u0441\u0430\u0445\u0430\u0440\u043e\u043c\",\n    \"language\": \"ru\",\n    \"region\": \"ru\",\n    \"language_description\": \"russian\",\n    \"region_description\": \"russia\",\n    \"query\": [\n        7175,\n        1408,\n        100233,\n        100234\n    ],\n    \"ingredients\": [\n        {\n            \"food_id\": 7175,\n            \"food_name\": \"\u0421\u0430\u0445\u0430\u0440\",\n            \"food_type\": \"Generic\",\n            \"brand_name\": \"\",\n            \"match_accuracy\": 100,\n            \"eaten\": {\n                \"singular_description\": \"\",\n                \"plural_description\": \"\",\n                \"units\": 1,\n                \"metric_description\": \"g\",\n                \"per_unit_metric_amount\": 20,\n                \"total_metric_amount\": 20,\n                \"imperial_description\": \"oz\",\n                \"per_unit_imperial_amount\": 0.705,\n                \"total_imperial_amount\": 0.705\n            },\n            \"suggested_serving\": {\n                \"serving_id\": \"27026\",\n                \"serving\": \"1 \u0447.\u043b. (4.200 \u0433)\",\n                \"is_default\": 1,\n                \"serving_description\": \"1 \u0447.\u043b.\",\n                \"number_of_units\": 1\n            }\n        },\n        {\n            \"food_id\": 1408,\n            \"food_name\": \"\u042f\u0439\u0446\u043e\",\n            \"food_type\": \"Generic\",\n            \"brand_name\": \"\",\n            \"match_accuracy\": 100,\n            \"eaten\": {\n                \"singular_description\": \"\u044f\u0439\u0446\u043e\",\n                \"plural_description\": \"\u044f\u0439\u0446\u0430\",\n                \"units\": 2,\n                \"metric_description\": \"g\",\n                \"per_unit_metric_amount\": 50,\n                \"total_metric_amount\": 100,\n                \"imperial_description\": \"oz\",\n                \"per_unit_imperial_amount\": 1.764,\n                \"total_imperial_amount\": 3.528\n            },\n            \"suggested_serving\": {\n                \"serving_id\": \"27026\",\n                \"serving\": \"1 \u0448\u0442. (50.000 \u0433)\",\n                \"is_default\": 1,\n                \"serving_description\": \"1 \u0448\u0442.\",\n                \"number_of_units\": 2\n            }\n        },\n        {\n            \"food_id\": 100233,\n            \"food_name\": \"\u0425\u043b\u0435\u0431 \u0440\u0438\u0441\u043e\u0432\u044b\u0439\",\n            \"food_type\": \"Generic\",\n            \"brand_name\": \"\",\n            \"match_accuracy\": 100,\n            \"eaten\": {\n                \"singular_description\": \"\u043b\u043e\u043c\u0442\u0438\u043a\",\n                \"plural_description\": \"\u043b\u043e\u043c\u0442\u0438\u043a\u0438\",\n                \"units\": 1,\n                \"metric_description\": \"g\",\n                \"per_unit_metric_amount\": 25,\n                \"total_metric_amount\": 25,\n                \"imperial_description\": \"oz\",\n                \"per_unit_imperial_amount\": 0.882,\n                \"total_imperial_amount\": 0.882\n            },\n            \"suggested_serving\": {\n                \"serving_id\": \"27026\",\n                \"serving\": \"1 \u043b\u043e\u043c\u0442\u0438\u043a (25.000 \u0433)\",\n                \"is_default\": 1,\n                \"serving_description\": \"1 \u043b\u043e\u043c\u0442\u0438\u043a\",\n                \"number_of_units\": 1\n            }\n        },\n        {\n            \"food_id\": 100234,\n            \"food_name\": \"\u041a\u043e\u0444\u0435\",\n            \"food_type\": \"Generic\",\n            \"brand_name\": \"\",\n            \"match_accuracy\": 100,\n            \"eaten\": {\n                \"singular_description\": \"\",\n                \"plural_description\": \"\",\n                \"units\": 1,\n                \"metric_description\": \"ml\",\n                \"per_unit_metric_amount\": 240,\n                \"total_metric_amount\": 240,\n                \"imperial_description\": \"fl oz\",\n                \"per_unit_imperial_amount\": 8,\n                \"total_imperial_amount\": 8\n            },\n            \"suggested_serving\": {\n                \"serving_id\": \"27026\",\n                \"serving\": \"1 \u0441\u0442\u0430\u043a\u0430\u043d (240.000 \u043c\u043b)\",\n                \"is_default\": 1,\n                \"serving_description\": \"1 \u0441\u0442\u0430\u043a\u0430\u043d\",\n                \"number_of_units\": 1\n            }\n        }\n    ]\n}",
        "invocation_time": 4.50906229019165,
        "cost": 0.0015473700000000002
      },
      {
        "food_query": 7331,
        "model_id": "us.amazon.nova-micro-v1:0",
        "actual": "{\n  \"input\": \"\u042f \u0435\u043b\u0430 \u044f\u0438\u0447\u043d\u0438\u0446\u0443 \u0438\u0437 \u0434\u0432\u0443\u0445 \u044f\u0438\u0446 \u0441 \u0440\u0438\u0441\u043e\u043c \u0445\u043b\u0435\u0431\u043e\u043c \u0438 \u0441\u044b\u0440\u043e\u043c \u0441 \u0442\u043e\u0441\u0442\u043e\u043c \u043e\u0434\u043d\u0438\u043c \u043b\u043e\u043c\u0442\u0438\u043a\u043e\u043c \u0440\u0438\u0441\u0430 \u0445\u043b\u0435\u0431\u0430 \u0438 \u0441\u044b\u0440\u0430 \u0441 \u0442\u043e\u0441\u0442\u043e\u043c \u0438 \u043a\u043e\u0444\u0435 \u0441 \u0441\u0430\u0445\u0430\u0440\u043e\u043c \u0438 \u043b\u0438\u043c\u043e\u043d\u043e\u043c \u0438 \u0432\u043e\u0434\u043a\u043e\u0439\",\n  \"language\": \"ru\",\n  \"region\": \"ru\",\n  \"language_description\": \"russian\",\n  \"region_description\": \"russia\",\n  \"include_servings\": \"defaultAndGrams\",\n  \"foods\": [\n    {\n      \"query\": 7331,\n      \"results\": [\n        {\n          \"food_id\": \"7331\",\n          \"food_name\": \"\u041a\u043e\u0444\u0435\",\n          \"food_type\": \"Generic\",\n          \"servings\": {\n            \"serving\": {\n              \"serving_id\": \"27699\",\n              \"serving_description\": \"1 \u0447\u0430\u0448\u043a\u0430 (240 \u043c\u043b)\",\n              \"is_default\": \"1\",\n              \"serving\": \"1 \u0447\u0430\u0448\u043a\u0430 (240 \u043c\u043b) (237.000 \u0433)\"\n            }\n          }\n        }\n      ]\n    }\n  ]\n}\n\n{\n  \"input\": \"\u042f \u0435\u043b\u0430 \u044f\u0438\u0447\u043d\u0438\u0446\u0443 \u0438\u0437 \u0434\u0432\u0443\u0445 \u044f\u0438\u0446 \u0441 \u0440\u0438\u0441\u043e\u043c \u0445\u043b\u0435\u0431\u043e\u043c \u0438 \u0441\u044b\u0440\u043e\u043c \u0441 \u0442\u043e\u0441\u0442\u043e\u043c \u043e\u0434\u043d\u0438\u043c \u043b\u043e\u043c\u0442\u0438\u043a\u043e\u043c \u0440\u0438\u0441\u0430 \u0445\u043b\u0435\u0431\u0430 \u0438 \u0441\u044b\u0440\u0430 \u0441 \u0442\u043e\u0441\u0442\u043e\u043c \u0438 \u043a\u043e\u0444\u0435 \u0441 \u0441\u0430\u0445\u0430\u0440\u043e\u043c \u0438 \u043b\u0438\u043c\u043e\u043d\u043e\u043c \u0438 \u0432\u043e\u0434\u043a\u043e\u0439\",\n  \"language\": \"ru\",\n  \"region\": \"ru\",\n  \"language_description\": \"russian\",\n  \"region_description\": \"russia\",\n  \"query\": [\n    \"7331\"\n  ],\n  \"ingredients\": [\n    {\n      \"food_id\": 7331,\n      \"food_name\": \"\u041a\u043e\u0444\u0435\",\n      \"food_type\": \"Generic\",\n      \"brand_name\": \"\",\n      \"match_accuracy\": 100,\n      \"eaten\": {\n        \"singular_description\": \"\u0447\u0430\u0448\u043a\u0430\",\n        \"plural_description\": \"\u0447\u0430\u0448\u043a\u0438\",\n        \"units\": 1,\n        \"metric_description\": \"\u043c\u043b\",\n        \"per_unit_metric_amount\": 240,\n        \"total_metric_amount\": 240,\n        \"imperial_description\": \"fl oz\",\n        \"per_unit_imperial_amount\": 8,\n        \"total_imperial_amount\": 8\n      },\n      \"suggested_serving\": {\n        \"serving_id\": \"27699\",\n        \"serving\": \"1 \u0447\u0430\u0448\u043a\u0430 (240 \u043c\u043b)\",\n        \"is_default\": 1,\n        \"serving_description\": \"1 \u0447\u0430\u0448\u043a\u0430 (240 \u043c\u043b)\",\n        \"number_of_units\": 1\n      }\n    }\n  ]\n}",
        "invocation_time": 3.090193510055542,
        "cost": 0.0011257200000000002
      },
      {
        "food_query": 2811717,
        "model_id": "us.meta.llama4-maverick-17b-instruct-v1:0",
        "actual": "```json\n{\n  \"input\": \"\u042f \u0435\u043b\u0430 \u044f\u0438\u0447\u043d\u0438\u0446\u0443 \u0438\u0437 \u0434\u0432\u0443\u0445 \u044f\u0438\u0446 \u043f\u043e\u0441\u044b\u043f\u0430\u043d\u043d\u0443\u044e \u0441\u043e\u043b\u044c\u044e \u0441 \u0442\u0440\u0430\u0432\u0430\u043c\u0438 \u043e\u0434\u0438\u043d \u043b\u043e\u043c\u0442\u0438\u043a \u0440\u0438\u0441\u043e\u0432\u044b\u0439 \u0445\u043b\u0435\u0431 \u0441 \u0442\u0432\u043e\u0440\u043e\u0436\u043d\u044b\u043c \u0441\u044b\u0440\u043e\u043c \u0438 \u043a\u043e\u0444\u0435 \u0441 \u0441\u0430\u0445\u0430\u0440\u043e\u043c \u0438 \u0441\u043b\u0438\u0432\u043a\u0430\u043c\u0438\",\n  \"language\": \"ru\",\n  \"region\": \"ru\",\n  \"language_description\": \"russian\",\n  \"region_description\": \"russia\",\n  \"query\": [\n    \"2811717\"\n  ],\n  \"ingredients\": [\n    {\n      \"food_id\": 2811717,\n      \"food_name\": \"\u0422\u0432\u043e\u0440\u043e\u0436\u043d\u044b\u0439 \u0421\u044b\u0440\",\n      \"food_type\": \"Brand\",\n      \"brand_name\": \"\u0425\u043e\u0445\u043b\u0430\u043d\u0434\",\n      \"match_accuracy\": 100,\n      \"eaten\": {\n        \"singular_description\": \"\u043b\u043e\u043c\u0442\u0438\u043a\",\n        \"plural_description\": \"\u043b\u043e\u043c\u0442\u0438\u043a\u0438\",\n        \"units\": 1.0,\n        \"metric_description\": \"g\",\n        \"per_unit_metric_amount\": 30.0,\n        \"total_metric_amount\": 30.0,\n        \"imperial_description\": \"oz\",\n        \"per_unit_imperial_amount\": 1.058,\n        \"total_imperial_amount\": 1.058\n      },\n      \"suggested_serving\": {\n        \"serving_id\": \"2739553\",\n        \"serving\": \"100\u0433 (100.000 \u0433)\",\n        \"is_default\": 1,\n        \"serving_description\": \"100\u0433\",\n        \"number_of_units\": 0.3\n      }\n    }\n  ]\n}\n```",
        "invocation_time": 1.874756097793579,
        "cost": 0.00072777
      },
      {
        "food_query": 3447997,
        "model_id": "us.meta.llama4-maverick-17b-instruct-v1:0",
        "actual": "```json\n{\n  \"input\": \"\u042f \u0435\u043b\u0430 \u044f\u0438\u0447\u043d\u0438\u0446\u0443 \u0438\u0437 \u0434\u0432\u0443\u0445 \u044f\u0438\u0446 \u043f\u043e\u0441\u044b\u043f\u0430\u043d\u043d\u0443\u044e \u0441\u043e\u043b\u044c\u044e \u0441 \u0442\u0440\u0430\u0432\u0430\u043c\u0438 \u043e\u0434\u0438\u043d \u043b\u043e\u043c\u0442\u0438\u043a \u0440\u0438\u0441\u043e\u0432\u044b\u0439 \u0445\u043b\u0435\u0431 \u0441 \u0442\u0432\u043e\u0440\u043e\u0436\u043d\u044b\u043c \u0441\u044b\u0440\u043e\u043c \u0438 \u043a\u043e\u0444\u0435 \u0441 \u0441\u0430\u0445\u0430\u0440\u043e\u043c \u0438 \u0441\u043b\u0438\u0432\u043a\u0430\u043c\u0438\",\n  \"language\": \"ru\",\n  \"region\": \"ru\",\n  \"language_description\": \"russian\",\n  \"region_description\": \"russia\",\n  \"query\": [\n    \"3447997\"\n  ],\n  \"ingredients\": [\n    {\n      \"food_id\": 3447997,\n      \"food_name\": \"\u0421\u043b\u0438\u0432\u043a\u0438 10%\",\n      \"food_type\": \"Brand\",\n      \"brand_name\": \"\u041f\u0440\u043e\u0441\u0442\u043e\u043a\u0432\u0430\u0448\u0438\u043d\u043e\",\n      \"match_accuracy\": 100,\n      \"eaten\": {\n        \"singular_description\": \"\u0441\u043b\u0438\u0432\u043a\u0430\",\n        \"plural_description\": \"\u0441\u043b\u0438\u0432\u043a\u0438\",\n        \"units\": 1,\n        \"metric_description\": \"ml\",\n        \"per_unit_metric_amount\": 100,\n        \"total_metric_amount\": 100,\n        \"imperial_description\": \"fl oz\",\n        \"per_unit_imperial_amount\": 3.38,\n        \"total_imperial_amount\": 3.38\n      },\n      \"suggested_serving\": {\n        \"serving_id\": \"3353970\",\n        \"serving\": \"100\u043c\u043b (100.000 \u043c\u043b)\",\n        \"is_default\": 1,\n        \"serving_description\": \"100\u043c\u043b\",\n        \"number_of_units\": 1\n      }\n    },\n    {\n      \"food_id\": null,\n      \"food_name\": \"\u044f\u0438\u0447\u043d\u0438\u0446\u0430\",\n      \"food_type\": null,\n      \"brand_name\": \"\",\n      \"match_accuracy\": null,\n      \"eaten\": {\n        \"singular_description\": \"\u044f\u0438\u0447\u043d\u0438\u0446\u0430\",\n        \"plural_description\": \"\u044f\u0438\u0447\u043d\u0438\u0446\u044b\",\n        \"units\": 1,\n        \"metric_description\": \"g\",\n        \"per_unit_metric_amount\": 140,\n        \"total_metric_amount\": 140,\n        \"imperial_description\": \"oz\",\n        \"per_unit_imperial_amount\": 4.94,\n        \"total_imperial_amount\": 4.94\n      },\n      \"suggested_serving\": {\n        \"serving_id\": null,\n        \"serving\": null,\n        \"is_default\": null,\n        \"serving_description\": \"serving\",\n        \"number_of_units\": 1\n      }\n    },\n    {\n      \"food_id\": null,\n      \"food_name\": \"\u0440\u0438\u0441\u043e\u0432\u0438\u0439 \u0445\u043b\u0435\u0431\",\n      \"food_type\": null,\n      \"brand_name\": \"\",\n      \"match_accuracy\": null,\n      \"eaten\": {\n        \"singular_description\": \"\u043b\u043e\u043c\u0442\u0438\u043a\",\n        \"plural_description\": \"\u043b\u043e\u043c\u0442\u0438\u043a\u0438\",\n        \"units\": 1,\n        \"metric_description\": \"g\",\n        \"per_unit_metric_amount\": 30,\n        \"total_metric_amount\": 30,\n        \"imperial_description\": \"oz\",\n        \"per_unit_imperial_amount\": 1.06,\n        \"total_imperial_amount\": 1.06\n      },\n      \"suggested_serving\": {\n        \"serving_id\": null,\n        \"serving\": null,\n        \"is_default\": null,\n        \"serving_description\": \"slice\",\n        \"number_of_units\": 1\n      }\n    },\n    {\n      \"food_id\": null,\n      \"food_name\": \"\u0442\u0432\u043e\u0440\u043e\u0436\u043d\u044b\u0439 \u0441\u044b\u0440\",\n      \"food_type\": null,\n      \"brand_name\": \"\",\n      \"match_accuracy\": null,\n      \"eaten\": {\n        \"singular_description\": null,\n        \"plural_description\": null,\n        \"units\": 1,\n        \"metric_description\": \"g\",\n        \"per_unit_metric_amount\": 50,\n        \"total_metric_amount\": 50,\n        \"imperial_description\": \"oz\",\n        \"per_unit_imperial_amount\": 1.76,\n        \"total_imperial_amount\": 1.76\n      },\n      \"suggested_serving\": {\n        \"serving_id\": null,\n        \"serving\": null,\n        \"is_default\": null,\n        \"serving_description\": \"serving\",\n        \"number_of_units\": 1\n      }\n    },\n    {\n      \"food_id\": null,\n      \"food_name\": \"\u043a\u043e\u0444\u0435\",\n      \"food_type\": null,\n      \"brand_name\": \"\",\n      \"match_accuracy\": null,\n      \"eaten\": {\n        \"singular_description\": \"\u0447\u0430\u0448\u043a\u0430\",\n        \"plural_description\": \"\u0447\u0430\u0448\u043a\u0438\",\n        \"units\": 1,\n        \"metric_description\": \"ml\",\n        \"per_unit_metric_amount\": 240,\n        \"total_metric_amount\": 240,\n        \"imperial_description\": \"fl oz\",\n        \"per_unit_imperial_amount\": 8.12,\n        \"total_imperial_amount\": 8.12\n      },\n      \"suggested_serving\": {\n        \"serving_id\": null,\n        \"serving\": null,\n        \"is_default\": null,\n        \"serving_description\": \"cup\",\n        \"number_of_units\": 1\n      }\n    },\n    {\n      \"food_id\": null,\n      \"food_name\": \"\u0441\u0430\u0445\u0430\u0440\",\n      \"food_type\": null,\n      \"brand_name\": \"\",\n      \"match_accuracy\": null,\n      \"eaten\": {\n        \"singular_description\": null,\n        \"plural_description\": null,\n        \"units\": 1,\n        \"metric_description\": \"g\",\n        \"per_unit_metric_amount\": 4,\n        \"total_metric_amount\": 4,\n        \"imperial_description\": \"oz\",\n        \"per_unit_imperial_amount\": 0.14,\n        \"total_imperial_amount\": 0.14\n      },\n      \"suggested_serving\": {\n        \"serving_id\": null,\n        \"serving\": null,\n        \"is_default\": null,\n        \"serving_description\": \"teaspoon\",\n        \"number_of_units\": 1\n      }\n    }\n  ]\n}\n```",
        "invocation_time": 4.774892091751099,
        "cost": 0.00162451
      }
    ],
    "ingredients": "```json\n{\n  \"input\": \"\u042f \u0435\u043b\u0430 \u044f\u0438\u0447\u043d\u0438\u0446\u0443 \u0438\u0437 \u0434\u0432\u0443\u0445 \u044f\u0438\u0446 \u043f\u043e\u0441\u044b\u043f\u0430\u043d\u043d\u0443\u044e \u0441\u043e\u043b\u044c\u044e \u0441 \u0442\u0440\u0430\u0432\u0430\u043c\u0438 \u043e\u0434\u0438\u043d \u043b\u043e\u043c\u0442\u0438\u043a \u0440\u0438\u0441\u043e\u0432\u044b\u0439 \u0445\u043b\u0435\u0431 \u0441 \u0442\u0432\u043e\u0440\u043e\u0436\u043d\u044b\u043c \u0441\u044b\u0440\u043e\u043c \u0438 \u043a\u043e\u0444\u0435 \u0441 \u0441\u0430\u0445\u0430\u0440\u043e\u043c \u0438 \u0441\u043b\u0438\u0432\u043a\u0430\u043c\u0438\",\n  \"language\": \"ru\",\n  \"region\": \"ru\",\n  \"language_description\": \"russian\",\n  \"region_description\": \"russia\",\n  \"query\": [\n    \"39866\"\n  ],\n  \"ingredients\": [\n    {\n      \"food_id\": 39866,\n      \"food_name\": \"\u042f\u0438\u0447\u043d\u0438\u0446\u0430\",\n      \"food_type\": \"Generic\",\n      \"brand_name\": \"\",\n      \"match_accuracy\": 100,\n      \"eaten\": {\n        \"singular_description\": \"\u044f\u0439\u0446\u043e\",\n        \"plural_description\": \"\u044f\u0439\u0446\u0430\",\n        \"units\": 2,\n        \"metric_description\": \"g\",\n        \"per_unit_metric_amount\": 47,\n        \"total_metric_amount\": 94,\n        \"imperial_description\": \"oz\",\n        \"per_unit_imperial_amount\": 1.66,\n        \"total_imperial_amount\": 3.32\n      },\n      \"suggested_serving\": {\n        \"serving_id\": \"40472\",\n        \"serving\": \"2 \u044f\u0439\u0446\u0430 (94.000 \u0433)\",\n        \"is_default\": 1,\n        \"serving_description\": \"2 \u044f\u0439\u0446\u0430\",\n        \"number_of_units\": 1\n      }\n    },\n    {\n      \"food_id\": null,\n      \"food_name\": \"\u0441\u043e\u043b\u044c\",\n      \"food_type\": null,\n      \"brand_name\": \"\",\n      \"match_accuracy\": null,\n      \"eaten\": {\n        \"singular_description\": \"\",\n        \"plural_description\": \"\",\n        \"units\": 1,\n        \"metric_description\": \"g\",\n        \"per_unit_metric_amount\": null,\n        \"total_metric_amount\": null,\n        \"imperial_description\": \"oz\",\n        \"per_unit_imperial_amount\": null,\n        \"total_imperial_amount\": null\n      },\n      \"suggested_serving\": {\n        \"serving_id\": null,\n        \"serving\": null,\n        \"is_default\": null,\n        \"serving_description\": null,\n        \"number_of_units\": null\n      }\n    },\n    {\n      \"food_id\": null,\n      \"food_name\": \"\u0442\u0440\u0430\u0432\u044b\",\n      \"food_type\": null,\n      \"brand_name\": \"\",\n      \"match_accuracy\": null,\n      \"eaten\": {\n        \"singular_description\": \"\",\n        \"plural_description\": \"\",\n        \"units\": 1,\n        \"metric_description\": \"g\",\n        \"per_unit_metric_amount\": null,\n        \"total_metric_amount\": null,\n        \"imperial_description\": \"oz\",\n        \"per_unit_imperial_amount\": null,\n        \"total_imperial_amount\": null\n      },\n      \"suggested_serving\": {\n        \"serving_id\": null,\n        \"serving\": null,\n        \"is_default\": null,\n        \"serving_description\": null,\n        \"number_of_units\": null\n      }\n    },\n    {\n      \"food_id\": null,\n      \"food_name\": \"\u043b\u043e\u043c\u0442\u0438\u043a \u0440\u0438\u0441\u043e\u0432\u044b\u0439 \u0445\u043b\u0435\u0431\",\n      \"food_type\": null,\n      \"brand_name\": \"\",\n      \"match_accuracy\": null,\n      \"eaten\": {\n        \"singular_description\": \"\u043b\u043e\u043c\u0442\u0438\u043a\",\n        \"plural_description\": \"\u043b\u043e\u043c\u0442\u0438\u043a\u0438\",\n        \"units\": 1,\n        \"metric_description\": \"g\",\n        \"per_unit_metric_amount\": null,\n        \"total_metric_amount\": null,\n        \"imperial_description\": \"oz\",\n        \"per_unit_imperial_amount\": null,\n        \"total_imperial_amount\": null\n      },\n      \"suggested_serving\": {\n        \"serving_id\": null,\n        \"serving\": null,\n        \"is_default\": null,\n        \"serving_description\": null,\n        \"number_of_units\": null\n      }\n    },\n    {\n      \"food_id\": null,\n      \"food_name\": \"\u0442\u0432\u043e\u0440\u043e\u0436\u043d\u044b\u0439 \u0441\u044b\u0440\",\n      \"food_type\": null,\n      \"brand_name\": \"\",\n      \"match_accuracy\": null,\n      \"eaten\": {\n        \"singular_description\": \"\",\n        \"plural_description\": \"\",\n        \"units\": 1,\n        \"metric_description\": \"g\",\n        \"per_unit_metric_amount\": null,\n        \"total_metric_amount\": null,\n        \"imperial_description\": \"oz\",\n        \"per_unit_imperial_amount\": null,\n        \"total_imperial_amount\": null\n      },\n      \"suggested_serving\": {\n        \"serving_id\": null,\n        \"serving\": null,\n        \"is_default\": null,\n        \"serving_description\": null,\n        \"number_of_units\": null\n      }\n    },\n    {\n      \"food_id\": null,\n      \"food_name\": \"\u043a\u043e\u0444\u0435\",\n      \"food_type\": null,\n      \"brand_name\": \"\",\n      \"match_accuracy\": null,\n      \"eaten\": {\n        \"singular_description\": \"\",\n        \"plural_description\": \"\",\n        \"units\": 1,\n        \"metric_description\": \"ml\",\n        \"per_unit_metric_amount\": null,\n        \"total_metric_amount\": null,\n        \"imperial_description\": \"fl oz\",\n        \"per_unit_imperial_amount\": null,\n        \"total_imperial_amount\": null\n      },\n      \"suggested_serving\": {\n        \"serving_id\": null,\n        \"serving\": null,\n        \"is_default\": null,\n        \"serving_description\": null,\n        \"number_of_units\": null\n      }\n    },\n    {\n      \"food_id\": null,\n      \"food_name\": \"\u0441\u0430\u0445\u0430\u0440\",\n      \"food_type\": null,\n      \"brand_name\": \"\",\n      \"match_accuracy\": null,\n      \"eaten\": {\n        \"singular_description\": \"\",\n        \"plural_description\": \"\",\n        \"units\": 1,\n        \"metric_description\": \"g\",\n        \"per_unit_metric_amount\": null,\n        \"total_metric_amount\": null,\n        \"imperial_description\": \"oz\",\n        \"per_unit_imperial_amount\": null,\n        \"total_imperial_amount\": null\n      },\n      \"suggested_serving\": {\n        \"serving_id\": null,\n        \"serving\": null,\n        \"is_default\": null,\n        \"serving_description\": null,\n        \"number_of_units\": null\n      }\n    },\n    {\n      \"food_id\": null,\n      \"food_name\": \"\u0441\u043b\u0438\u0432\u043a\u0438\",\n      \"food_type\": null,\n      \"brand_name\": \"\",\n      \"match_accuracy\": null,\n      \"eaten\": {\n        \"singular_description\": \"\",\n        \"plural_description\": \"\",\n        \"units\": 1,\n        \"metric_description\": \"ml\",\n        \"per_unit_metric_amount\": null,\n        \"total_metric_amount\": null,\n        \"imperial_description\": \"fl oz\",\n        \"per_unit_imperial_amount\": null,\n        \"total_imperial_amount\": null\n      },\n      \"suggested_serving\": {\n        \"serving_id\": null,\n        \"serving\": null,\n        \"is_default\": null,\n        \"serving_description\": null,\n        \"number_of_units\": null\n      }\n    }\n  ]\n}\n``` {\n    \"input\": \"\u044f \u0435\u043b \u044f\u0438\u0447\u043d\u0438\u0446\u0443 \u0438\u0437 \u0434\u0432\u0443\u0445 \u044f\u0438\u0446 \u043f\u043e\u0441\u044b\u043f\u0430\u043d\u043d\u0443\u044e \u0441\u043e\u043b\u044c\u044e \u0438 \u0442\u0440\u0430\u0432\u0430\u043c\u0438 \u043e\u0434\u043d\u0438\u043c \u043b\u043e\u043c\u0442\u0438\u043a\u043e\u043c \u0440\u0438\u0441\u043e\u0432\u043e\u0433\u043e \u0445\u043b\u0435\u0431\u0430 \u0441 \u0442\u043e\u043c\u0430\u0442\u043d\u044b\u043c \u0441\u043e\u0443\u0441\u043e\u043c \u0438 \u043a\u043e\u0444\u0435 \u0441 \u0441\u0430\u0445\u0430\u0440\u043e\u043c\",\n    \"language\": \"ru\",\n    \"region\": \"ru\",\n    \"language_description\": \"russian\",\n    \"region_description\": \"russia\",\n    \"query\": [\n        7397074\n    ],\n    \"ingredients\": [\n        {\n            \"food_id\": 7397074,\n            \"food_name\": \"\u041f\u0440\u043e\u0432\u0430\u043d\u0441\u043a\u0438\u0435 \u0422\u0440\u0430\u0432\u044b\",\n            \"food_type\": \"Brand\",\n            \"brand_name\": \"Kamis\",\n            \"match_accuracy\": 100,\n            \"eaten\": {\n                \"singular_description\": \"\u043f\u0440\u044b\u0449\",\n                \"plural_description\": \"\u043f\u0440\u044b\u0449\u0438\",\n                \"units\": 1,\n                \"metric_description\": \"g\",\n                \"per_unit_metric_amount\": 10,\n                \"total_metric_amount\": 10,\n                \"imperial_description\": \"oz\",\n                \"per_unit_imperial_amount\": 0.35274,\n                \"total_imperial_amount\": 0.35274\n            },\n            \"suggested_serving\": {\n                \"serving_id\": \"7133790\",\n                \"serving\": \"100\u0433 (100.000 \u0433)\",\n                \"is_default\": 1,\n                \"serving_description\": \"100\u0433\",\n                \"number_of_units\": 1\n            }\n        }\n    ]\n} {\n  \"input\": \"\u042f \u0435\u043b\u0430 \u044f\u0438\u0447\u043d\u0438\u0446\u0443 \u0438\u0437 \u0434\u0432\u0443\u0445 \u044f\u0438\u0446 \u0441 \u0440\u0438\u0441\u043e\u043c \u0438 \u0441\u044b\u0440\u043e\u043c \u0441 \u0442\u043e\u0441\u0442\u043e\u043c \u043e\u0434\u043d\u0443 \u043b\u043e\u0436\u043a\u0443 \u0440\u0438\u0441\u043e\u0432\u043e\u0433\u043e \u0445\u043b\u0435\u0431\u0430 \u0441 \u0441\u044b\u0440\u043e\u043c \u0438 \u043a\u043e\u043b\u0431\u0430\u0441\u043e\u0439 \u0441 \u0441\u0430\u0445\u0430\u0440\u043e\u043c \u0438 \u0441\u043b\u0438\u0432\u043a\u0430\u043c\u0438\",\n  \"language\": \"ru\",\n  \"region\": \"ru\",\n  \"language_description\": \"russian\",\n  \"region_description\": \"russia\",\n  \"include_servings\": \"defaultAndGrams\",\n  \"query\": [\n    33908\n  ],\n  \"ingredients\": [\n    {\n      \"food_id\": 33908,\n      \"food_name\": \"\u0421\u043e\u043b\u044c\",\n      \"food_type\": \"Generic\",\n      \"brand_name\": \"\",\n      \"match_accuracy\": 100,\n      \"eaten\": {\n        \"singular_description\": \"\u0433\u0440\u0430\u043c\u043c\",\n        \"plural_description\": \"\u0433\u0440\u0430\u043c\u043c\",\n        \"units\": 0.4,\n        \"metric_description\": \"g\",\n        \"per_unit_metric_amount\": 0.4,\n        \"total_metric_amount\": 0.4,\n        \"imperial_description\": \"oz\",\n        \"per_unit_imperial_amount\": 0.0141748,\n        \"total_imperial_amount\": 0.0057099\n      },\n      \"suggested_serving\": {\n        \"serving_id\": \"29654\",\n        \"serving\": \"1 \u043d\u0435\u0431\u043e\u043b\u044c\u0448\u0430\u044f \u0447\u0430\u0439\u043d\u0430\u044f \u043b\u043e\u0436\u043a\u0430 (0.400 \u0433)\",\n        \"is_default\": 1,\n        \"serving_description\": \"1 \u043d\u0435\u0431\u043e\u043b\u044c\u0448\u0430\u044f \u0447\u0430\u0439\u043d\u0430\u044f \u043b\u043e\u0436\u043a\u0430\",\n        \"number_of_units\": 0.4\n      }\n    }\n  ]\n} {\n    \"input\": \"\u044f \u0435\u043b \u044f\u0438\u0447\u043d\u0438\u0446\u0443 \u0438\u0437 \u0434\u0432\u0443\u0445 \u044f\u0438\u0446 \u043f\u043e\u0441\u044b\u043f\u0430\u043d\u043d\u0443\u044e \u0441\u043e\u043b\u044c\u044e \u0438 \u0442\u0440\u0430\u0432\u0430\u043c\u0438 \u043e\u0434\u043d\u0438\u043c \u043b\u043e\u043c\u0442\u0438\u043a\u043e\u043c \u0440\u0438\u0441\u043e\u0432\u043e\u0433\u043e \u0445\u043b\u0435\u0431\u0430 \u0441 \u0442\u043e\u043c\u0430\u0442\u043d\u044b\u043c \u0441\u043e\u0443\u0441\u043e\u043c \u0438 \u043a\u043e\u0444\u0435 \u0441 \u0441\u0430\u0445\u0430\u0440\u043e\u043c\",\n    \"language\": \"ru\",\n    \"region\": \"ru\",\n    \"language_description\": \"russian\",\n    \"region_description\": \"russia\",\n    \"query\": [\n        7175,\n        1408,\n        100233,\n        100234\n    ],\n    \"ingredients\": [\n        {\n            \"food_id\": 7175,\n            \"food_name\": \"\u0421\u0430\u0445\u0430\u0440\",\n            \"food_type\": \"Generic\",\n            \"brand_name\": \"\",\n            \"match_accuracy\": 100,\n            \"eaten\": {\n                \"singular_description\": \"\",\n                \"plural_description\": \"\",\n                \"units\": 1,\n                \"metric_description\": \"g\",\n                \"per_unit_metric_amount\": 20,\n                \"total_metric_amount\": 20,\n                \"imperial_description\": \"oz\",\n                \"per_unit_imperial_amount\": 0.705,\n                \"total_imperial_amount\": 0.705\n            },\n            \"suggested_serving\": {\n                \"serving_id\": \"27026\",\n                \"serving\": \"1 \u0447.\u043b. (4.200 \u0433)\",\n                \"is_default\": 1,\n                \"serving_description\": \"1 \u0447.\u043b.\",\n                \"number_of_units\": 1\n            }\n        },\n        {\n            \"food_id\": 1408,\n            \"food_name\": \"\u042f\u0439\u0446\u043e\",\n            \"food_type\": \"Generic\",\n            \"brand_name\": \"\",\n            \"match_accuracy\": 100,\n            \"eaten\": {\n                \"singular_description\": \"\u044f\u0439\u0446\u043e\",\n                \"plural_description\": \"\u044f\u0439\u0446\u0430\",\n                \"units\": 2,\n                \"metric_description\": \"g\",\n                \"per_unit_metric_amount\": 50,\n                \"total_metric_amount\": 100,\n                \"imperial_description\": \"oz\",\n                \"per_unit_imperial_amount\": 1.764,\n                \"total_imperial_amount\": 3.528\n            },\n            \"suggested_serving\": {\n                \"serving_id\": \"27026\",\n                \"serving\": \"1 \u0448\u0442. (50.000 \u0433)\",\n                \"is_default\": 1,\n                \"serving_description\": \"1 \u0448\u0442.\",\n                \"number_of_units\": 2\n            }\n        },\n        {\n            \"food_id\": 100233,\n            \"food_name\": \"\u0425\u043b\u0435\u0431 \u0440\u0438\u0441\u043e\u0432\u044b\u0439\",\n            \"food_type\": \"Generic\",\n            \"brand_name\": \"\",\n            \"match_accuracy\": 100,\n            \"eaten\": {\n                \"singular_description\": \"\u043b\u043e\u043c\u0442\u0438\u043a\",\n                \"plural_description\": \"\u043b\u043e\u043c\u0442\u0438\u043a\u0438\",\n                \"units\": 1,\n                \"metric_description\": \"g\",\n                \"per_unit_metric_amount\": 25,\n                \"total_metric_amount\": 25,\n                \"imperial_description\": \"oz\",\n                \"per_unit_imperial_amount\": 0.882,\n                \"total_imperial_amount\": 0.882\n            },\n            \"suggested_serving\": {\n                \"serving_id\": \"27026\",\n                \"serving\": \"1 \u043b\u043e\u043c\u0442\u0438\u043a (25.000 \u0433)\",\n                \"is_default\": 1,\n                \"serving_description\": \"1 \u043b\u043e\u043c\u0442\u0438\u043a\",\n                \"number_of_units\": 1\n            }\n        },\n        {\n            \"food_id\": 100234,\n            \"food_name\": \"\u041a\u043e\u0444\u0435\",\n            \"food_type\": \"Generic\",\n            \"brand_name\": \"\",\n            \"match_accuracy\": 100,\n            \"eaten\": {\n                \"singular_description\": \"\",\n                \"plural_description\": \"\",\n                \"units\": 1,\n                \"metric_description\": \"ml\",\n                \"per_unit_metric_amount\": 240,\n                \"total_metric_amount\": 240,\n                \"imperial_description\": \"fl oz\",\n                \"per_unit_imperial_amount\": 8,\n                \"total_imperial_amount\": 8\n            },\n            \"suggested_serving\": {\n                \"serving_id\": \"27026\",\n                \"serving\": \"1 \u0441\u0442\u0430\u043a\u0430\u043d (240.000 \u043c\u043b)\",\n                \"is_default\": 1,\n                \"serving_description\": \"1 \u0441\u0442\u0430\u043a\u0430\u043d\",\n                \"number_of_units\": 1\n            }\n        }\n    ]\n} {\n  \"input\": \"\u042f \u0435\u043b\u0430 \u044f\u0438\u0447\u043d\u0438\u0446\u0443 \u0438\u0437 \u0434\u0432\u0443\u0445 \u044f\u0438\u0446 \u0441 \u0440\u0438\u0441\u043e\u043c \u0445\u043b\u0435\u0431\u043e\u043c \u0438 \u0441\u044b\u0440\u043e\u043c \u0441 \u0442\u043e\u0441\u0442\u043e\u043c \u043e\u0434\u043d\u0438\u043c \u043b\u043e\u043c\u0442\u0438\u043a\u043e\u043c \u0440\u0438\u0441\u0430 \u0445\u043b\u0435\u0431\u0430 \u0438 \u0441\u044b\u0440\u0430 \u0441 \u0442\u043e\u0441\u0442\u043e\u043c \u0438 \u043a\u043e\u0444\u0435 \u0441 \u0441\u0430\u0445\u0430\u0440\u043e\u043c \u0438 \u043b\u0438\u043c\u043e\u043d\u043e\u043c \u0438 \u0432\u043e\u0434\u043a\u043e\u0439\",\n  \"language\": \"ru\",\n  \"region\": \"ru\",\n  \"language_description\": \"russian\",\n  \"region_description\": \"russia\",\n  \"include_servings\": \"defaultAndGrams\",\n  \"foods\": [\n    {\n      \"query\": 7331,\n      \"results\": [\n        {\n          \"food_id\": \"7331\",\n          \"food_name\": \"\u041a\u043e\u0444\u0435\",\n          \"food_type\": \"Generic\",\n          \"servings\": {\n            \"serving\": {\n              \"serving_id\": \"27699\",\n              \"serving_description\": \"1 \u0447\u0430\u0448\u043a\u0430 (240 \u043c\u043b)\",\n              \"is_default\": \"1\",\n              \"serving\": \"1 \u0447\u0430\u0448\u043a\u0430 (240 \u043c\u043b) (237.000 \u0433)\"\n            }\n          }\n        }\n      ]\n    }\n  ]\n}\n\n{\n  \"input\": \"\u042f \u0435\u043b\u0430 \u044f\u0438\u0447\u043d\u0438\u0446\u0443 \u0438\u0437 \u0434\u0432\u0443\u0445 \u044f\u0438\u0446 \u0441 \u0440\u0438\u0441\u043e\u043c \u0445\u043b\u0435\u0431\u043e\u043c \u0438 \u0441\u044b\u0440\u043e\u043c \u0441 \u0442\u043e\u0441\u0442\u043e\u043c \u043e\u0434\u043d\u0438\u043c \u043b\u043e\u043c\u0442\u0438\u043a\u043e\u043c \u0440\u0438\u0441\u0430 \u0445\u043b\u0435\u0431\u0430 \u0438 \u0441\u044b\u0440\u0430 \u0441 \u0442\u043e\u0441\u0442\u043e\u043c \u0438 \u043a\u043e\u0444\u0435 \u0441 \u0441\u0430\u0445\u0430\u0440\u043e\u043c \u0438 \u043b\u0438\u043c\u043e\u043d\u043e\u043c \u0438 \u0432\u043e\u0434\u043a\u043e\u0439\",\n  \"language\": \"ru\",\n  \"region\": \"ru\",\n  \"language_description\": \"russian\",\n  \"region_description\": \"russia\",\n  \"query\": [\n    \"7331\"\n  ],\n  \"ingredients\": [\n    {\n      \"food_id\": 7331,\n      \"food_name\": \"\u041a\u043e\u0444\u0435\",\n      \"food_type\": \"Generic\",\n      \"brand_name\": \"\",\n      \"match_accuracy\": 100,\n      \"eaten\": {\n        \"singular_description\": \"\u0447\u0430\u0448\u043a\u0430\",\n        \"plural_description\": \"\u0447\u0430\u0448\u043a\u0438\",\n        \"units\": 1,\n        \"metric_description\": \"\u043c\u043b\",\n        \"per_unit_metric_amount\": 240,\n        \"total_metric_amount\": 240,\n        \"imperial_description\": \"fl oz\",\n        \"per_unit_imperial_amount\": 8,\n        \"total_imperial_amount\": 8\n      },\n      \"suggested_serving\": {\n        \"serving_id\": \"27699\",\n        \"serving\": \"1 \u0447\u0430\u0448\u043a\u0430 (240 \u043c\u043b)\",\n        \"is_default\": 1,\n        \"serving_description\": \"1 \u0447\u0430\u0448\u043a\u0430 (240 \u043c\u043b)\",\n        \"number_of_units\": 1\n      }\n    }\n  ]\n} ```json\n{\n  \"input\": \"\u042f \u0435\u043b\u0430 \u044f\u0438\u0447\u043d\u0438\u0446\u0443 \u0438\u0437 \u0434\u0432\u0443\u0445 \u044f\u0438\u0446 \u043f\u043e\u0441\u044b\u043f\u0430\u043d\u043d\u0443\u044e \u0441\u043e\u043b\u044c\u044e \u0441 \u0442\u0440\u0430\u0432\u0430\u043c\u0438 \u043e\u0434\u0438\u043d \u043b\u043e\u043c\u0442\u0438\u043a \u0440\u0438\u0441\u043e\u0432\u044b\u0439 \u0445\u043b\u0435\u0431 \u0441 \u0442\u0432\u043e\u0440\u043e\u0436\u043d\u044b\u043c \u0441\u044b\u0440\u043e\u043c \u0438 \u043a\u043e\u0444\u0435 \u0441 \u0441\u0430\u0445\u0430\u0440\u043e\u043c \u0438 \u0441\u043b\u0438\u0432\u043a\u0430\u043c\u0438\",\n  \"language\": \"ru\",\n  \"region\": \"ru\",\n  \"language_description\": \"russian\",\n  \"region_description\": \"russia\",\n  \"query\": [\n    \"2811717\"\n  ],\n  \"ingredients\": [\n    {\n      \"food_id\": 2811717,\n      \"food_name\": \"\u0422\u0432\u043e\u0440\u043e\u0436\u043d\u044b\u0439 \u0421\u044b\u0440\",\n      \"food_type\": \"Brand\",\n      \"brand_name\": \"\u0425\u043e\u0445\u043b\u0430\u043d\u0434\",\n      \"match_accuracy\": 100,\n      \"eaten\": {\n        \"singular_description\": \"\u043b\u043e\u043c\u0442\u0438\u043a\",\n        \"plural_description\": \"\u043b\u043e\u043c\u0442\u0438\u043a\u0438\",\n        \"units\": 1.0,\n        \"metric_description\": \"g\",\n        \"per_unit_metric_amount\": 30.0,\n        \"total_metric_amount\": 30.0,\n        \"imperial_description\": \"oz\",\n        \"per_unit_imperial_amount\": 1.058,\n        \"total_imperial_amount\": 1.058\n      },\n      \"suggested_serving\": {\n        \"serving_id\": \"2739553\",\n        \"serving\": \"100\u0433 (100.000 \u0433)\",\n        \"is_default\": 1,\n        \"serving_description\": \"100\u0433\",\n        \"number_of_units\": 0.3\n      }\n    }\n  ]\n}\n``` ```json\n{\n  \"input\": \"\u042f \u0435\u043b\u0430 \u044f\u0438\u0447\u043d\u0438\u0446\u0443 \u0438\u0437 \u0434\u0432\u0443\u0445 \u044f\u0438\u0446 \u043f\u043e\u0441\u044b\u043f\u0430\u043d\u043d\u0443\u044e \u0441\u043e\u043b\u044c\u044e \u0441 \u0442\u0440\u0430\u0432\u0430\u043c\u0438 \u043e\u0434\u0438\u043d \u043b\u043e\u043c\u0442\u0438\u043a \u0440\u0438\u0441\u043e\u0432\u044b\u0439 \u0445\u043b\u0435\u0431 \u0441 \u0442\u0432\u043e\u0440\u043e\u0436\u043d\u044b\u043c \u0441\u044b\u0440\u043e\u043c \u0438 \u043a\u043e\u0444\u0435 \u0441 \u0441\u0430\u0445\u0430\u0440\u043e\u043c \u0438 \u0441\u043b\u0438\u0432\u043a\u0430\u043c\u0438\",\n  \"language\": \"ru\",\n  \"region\": \"ru\",\n  \"language_description\": \"russian\",\n  \"region_description\": \"russia\",\n  \"query\": [\n    \"3447997\"\n  ],\n  \"ingredients\": [\n    {\n      \"food_id\": 3447997,\n      \"food_name\": \"\u0421\u043b\u0438\u0432\u043a\u0438 10%\",\n      \"food_type\": \"Brand\",\n      \"brand_name\": \"\u041f\u0440\u043e\u0441\u0442\u043e\u043a\u0432\u0430\u0448\u0438\u043d\u043e\",\n      \"match_accuracy\": 100,\n      \"eaten\": {\n        \"singular_description\": \"\u0441\u043b\u0438\u0432\u043a\u0430\",\n        \"plural_description\": \"\u0441\u043b\u0438\u0432\u043a\u0438\",\n        \"units\": 1,\n        \"metric_description\": \"ml\",\n        \"per_unit_metric_amount\": 100,\n        \"total_metric_amount\": 100,\n        \"imperial_description\": \"fl oz\",\n        \"per_unit_imperial_amount\": 3.38,\n        \"total_imperial_amount\": 3.38\n      },\n      \"suggested_serving\": {\n        \"serving_id\": \"3353970\",\n        \"serving\": \"100\u043c\u043b (100.000 \u043c\u043b)\",\n        \"is_default\": 1,\n        \"serving_description\": \"100\u043c\u043b\",\n        \"number_of_units\": 1\n      }\n    },\n    {\n      \"food_id\": null,\n      \"food_name\": \"\u044f\u0438\u0447\u043d\u0438\u0446\u0430\",\n      \"food_type\": null,\n      \"brand_name\": \"\",\n      \"match_accuracy\": null,\n      \"eaten\": {\n        \"singular_description\": \"\u044f\u0438\u0447\u043d\u0438\u0446\u0430\",\n        \"plural_description\": \"\u044f\u0438\u0447\u043d\u0438\u0446\u044b\",\n        \"units\": 1,\n        \"metric_description\": \"g\",\n        \"per_unit_metric_amount\": 140,\n        \"total_metric_amount\": 140,\n        \"imperial_description\": \"oz\",\n        \"per_unit_imperial_amount\": 4.94,\n        \"total_imperial_amount\": 4.94\n      },\n      \"suggested_serving\": {\n        \"serving_id\": null,\n        \"serving\": null,\n        \"is_default\": null,\n        \"serving_description\": \"serving\",\n        \"number_of_units\": 1\n      }\n    },\n    {\n      \"food_id\": null,\n      \"food_name\": \"\u0440\u0438\u0441\u043e\u0432\u0438\u0439 \u0445\u043b\u0435\u0431\",\n      \"food_type\": null,\n      \"brand_name\": \"\",\n      \"match_accuracy\": null,\n      \"eaten\": {\n        \"singular_description\": \"\u043b\u043e\u043c\u0442\u0438\u043a\",\n        \"plural_description\": \"\u043b\u043e\u043c\u0442\u0438\u043a\u0438\",\n        \"units\": 1,\n        \"metric_description\": \"g\",\n        \"per_unit_metric_amount\": 30,\n        \"total_metric_amount\": 30,\n        \"imperial_description\": \"oz\",\n        \"per_unit_imperial_amount\": 1.06,\n        \"total_imperial_amount\": 1.06\n      },\n      \"suggested_serving\": {\n        \"serving_id\": null,\n        \"serving\": null,\n        \"is_default\": null,\n        \"serving_description\": \"slice\",\n        \"number_of_units\": 1\n      }\n    },\n    {\n      \"food_id\": null,\n      \"food_name\": \"\u0442\u0432\u043e\u0440\u043e\u0436\u043d\u044b\u0439 \u0441\u044b\u0440\",\n      \"food_type\": null,\n      \"brand_name\": \"\",\n      \"match_accuracy\": null,\n      \"eaten\": {\n        \"singular_description\": null,\n        \"plural_description\": null,\n        \"units\": 1,\n        \"metric_description\": \"g\",\n        \"per_unit_metric_amount\": 50,\n        \"total_metric_amount\": 50,\n        \"imperial_description\": \"oz\",\n        \"per_unit_imperial_amount\": 1.76,\n        \"total_imperial_amount\": 1.76\n      },\n      \"suggested_serving\": {\n        \"serving_id\": null,\n        \"serving\": null,\n        \"is_default\": null,\n        \"serving_description\": \"serving\",\n        \"number_of_units\": 1\n      }\n    },\n    {\n      \"food_id\": null,\n      \"food_name\": \"\u043a\u043e\u0444\u0435\",\n      \"food_type\": null,\n      \"brand_name\": \"\",\n      \"match_accuracy\": null,\n      \"eaten\": {\n        \"singular_description\": \"\u0447\u0430\u0448\u043a\u0430\",\n        \"plural_description\": \"\u0447\u0430\u0448\u043a\u0438\",\n        \"units\": 1,\n        \"metric_description\": \"ml\",\n        \"per_unit_metric_amount\": 240,\n        \"total_metric_amount\": 240,\n        \"imperial_description\": \"fl oz\",\n        \"per_unit_imperial_amount\": 8.12,\n        \"total_imperial_amount\": 8.12\n      },\n      \"suggested_serving\": {\n        \"serving_id\": null,\n        \"serving\": null,\n        \"is_default\": null,\n        \"serving_description\": \"cup\",\n        \"number_of_units\": 1\n      }\n    },\n    {\n      \"food_id\": null,\n      \"food_name\": \"\u0441\u0430\u0445\u0430\u0440\",\n      \"food_type\": null,\n      \"brand_name\": \"\",\n      \"match_accuracy\": null,\n      \"eaten\": {\n        \"singular_description\": null,\n        \"plural_description\": null,\n        \"units\": 1,\n        \"metric_description\": \"g\",\n        \"per_unit_metric_amount\": 4,\n        \"total_metric_amount\": 4,\n        \"imperial_description\": \"oz\",\n        \"per_unit_imperial_amount\": 0.14,\n        \"total_imperial_amount\": 0.14\n      },\n      \"suggested_serving\": {\n        \"serving_id\": null,\n        \"serving\": null,\n        \"is_default\": null,\n        \"serving_description\": \"teaspoon\",\n        \"number_of_units\": 1\n      }\n    }\n  ]\n}\n```",
    "total_cost": 0.00867738
  },
  {
    "row_index": 2,
    "total_time": 1.6723873615264893,
    "food_count": 1,
    "individual_results": [
      {
        "food_query": 90178387,
        "model_id": "us.amazon.nova-lite-v1:0",
        "actual": "{\n    \"input\": \"I had a tablespoon of chia seeds\",\n    \"language\": \"en\",\n    \"region\": \"us\",\n    \"language_description\": \"English\",\n    \"region_description\": \"United States\",\n    \"query\": [\n        90178387\n    ],\n    \"ingredients\": [\n        {\n            \"food_id\": 90178387,\n            \"food_name\": \"Chia Seeds\",\n            \"food_type\": \"Generic\",\n            \"brand_name\": \"\",\n            \"match_accuracy\": 100,\n            \"eaten\": {\n                \"singular_description\": \"tbsp\",\n                \"plural_description\": \"tbsps\",\n                \"units\": 1,\n                \"metric_description\": \"g\",\n                \"per_unit_metric_amount\": 13,\n                \"total_metric_amount\": 13,\n                \"imperial_description\": \"oz\",\n                \"per_unit_imperial_amount\": 0.46297,\n                \"total_imperial_amount\": 0.46297\n            },\n            \"suggested_serving\": {\n                \"serving_id\": \"72405542\",\n                \"serving\": \"1 tbsp (13.000 g)\",\n                \"is_default\": 1,\n                \"serving_description\": \"1 tbsp\",\n                \"number_of_units\": 1\n            }\n        }\n    ]\n}",
        "invocation_time": 1.6723134517669678,
        "cost": 0.0006764
      }
    ],
    "ingredients": "{\n    \"input\": \"I had a tablespoon of chia seeds\",\n    \"language\": \"en\",\n    \"region\": \"us\",\n    \"language_description\": \"English\",\n    \"region_description\": \"United States\",\n    \"query\": [\n        90178387\n    ],\n    \"ingredients\": [\n        {\n            \"food_id\": 90178387,\n            \"food_name\": \"Chia Seeds\",\n            \"food_type\": \"Generic\",\n            \"brand_name\": \"\",\n            \"match_accuracy\": 100,\n            \"eaten\": {\n                \"singular_description\": \"tbsp\",\n                \"plural_description\": \"tbsps\",\n                \"units\": 1,\n                \"metric_description\": \"g\",\n                \"per_unit_metric_amount\": 13,\n                \"total_metric_amount\": 13,\n                \"imperial_description\": \"oz\",\n                \"per_unit_imperial_amount\": 0.46297,\n                \"total_imperial_amount\": 0.46297\n            },\n            \"suggested_serving\": {\n                \"serving_id\": \"72405542\",\n                \"serving\": \"1 tbsp (13.000 g)\",\n                \"is_default\": 1,\n                \"serving_description\": \"1 tbsp\",\n                \"number_of_units\": 1\n            }\n        }\n    ]\n}",
    "total_cost": 0.0006764
  },
  {
    "row_index": 3,
    "total_time": 1.282231330871582,
    "food_count": 1,
    "individual_results": [
      {
        "food_query": 23052323,
        "model_id": "us.amazon.nova-micro-v1:0",
        "actual": "{\n  \"input\": \"8 ounce of strawberry smoothie\",\n  \"language\": \"en\",\n  \"region\": \"us\",\n  \"language_description\": \"English\",\n  \"region_description\": \"United States\",\n  \"query\": [\n    \"23052323\"\n  ],\n  \"ingredients\": [\n    {\n      \"food_id\": 23052323,\n      \"food_name\": \"Strawberry Smoothie\",\n      \"food_type\": \"Generic\",\n      \"brand_name\": \"\",\n      \"match_accuracy\": 100,\n      \"eaten\": {\n        \"singular_description\": \"fl oz\",\n        \"plural_description\": \"fl oz\",\n        \"units\": 8,\n        \"metric_description\": \"ml\",\n        \"per_unit_metric_amount\": 85.55,\n        \"total_metric_amount\": 684.4,\n        \"imperial_description\": \"fl oz\",\n        \"per_unit_imperial_amount\": 1,\n        \"total_imperial_amount\": 8\n      },\n      \"suggested_serving\": {\n        \"serving_id\": \"21565900\",\n        \"serving\": \"1 fl oz\",\n        \"is_default\": 0,\n        \"serving_description\": \"1 fl oz\",\n        \"number_of_units\": 8\n      }\n    }\n  ]\n}",
        "invocation_time": 1.2821171283721924,
        "cost": 0.00067819
      }
    ],
    "ingredients": "{\n  \"input\": \"8 ounce of strawberry smoothie\",\n  \"language\": \"en\",\n  \"region\": \"us\",\n  \"language_description\": \"English\",\n  \"region_description\": \"United States\",\n  \"query\": [\n    \"23052323\"\n  ],\n  \"ingredients\": [\n    {\n      \"food_id\": 23052323,\n      \"food_name\": \"Strawberry Smoothie\",\n      \"food_type\": \"Generic\",\n      \"brand_name\": \"\",\n      \"match_accuracy\": 100,\n      \"eaten\": {\n        \"singular_description\": \"fl oz\",\n        \"plural_description\": \"fl oz\",\n        \"units\": 8,\n        \"metric_description\": \"ml\",\n        \"per_unit_metric_amount\": 85.55,\n        \"total_metric_amount\": 684.4,\n        \"imperial_description\": \"fl oz\",\n        \"per_unit_imperial_amount\": 1,\n        \"total_imperial_amount\": 8\n      },\n      \"suggested_serving\": {\n        \"serving_id\": \"21565900\",\n        \"serving\": \"1 fl oz\",\n        \"is_default\": 0,\n        \"serving_description\": \"1 fl oz\",\n        \"number_of_units\": 8\n      }\n    }\n  ]\n}",
    "total_cost": 0.00067819
  },
  {
    "row_index": 4,
    "total_time": 2.0613222122192383,
    "food_count": 1,
    "individual_results": [
      {
        "food_query": 302993,
        "model_id": "us.amazon.nova-lite-v1:0",
        "actual": "{\n  \"input\": \"1 teaspoon of Jif peanut butter\",\n  \"language\": \"en\",\n  \"region\": \"us\",\n  \"language_description\": \"English\",\n  \"region_description\": \"United States\",\n  \"query\": [\n    302993\n  ],\n  \"ingredients\": [\n    {\n      \"food_id\": 302993,\n      \"food_name\": \"Natural Creamy Peanut Butter\",\n      \"food_type\": \"Brand\",\n      \"brand_name\": \"Jif\",\n      \"match_accuracy\": 100,\n      \"eaten\": {\n        \"singular_description\": \"teaspoon\",\n        \"plural_description\": \"teaspoons\",\n        \"units\": 1,\n        \"metric_description\": \"g\",\n        \"per_unit_metric_amount\": 4.73,\n        \"total_metric_amount\": 4.73,\n        \"imperial_description\": \"oz\",\n        \"per_unit_imperial_amount\": 0.1667,\n        \"total_imperial_amount\": 0.1667\n      },\n      \"suggested_serving\": {\n        \"serving_id\": \"338024\",\n        \"serving\": \"2 tbsp (33.000 g)\",\n        \"is_default\": 1,\n        \"serving_description\": \"2 tbsp\",\n        \"number_of_units\": 0.0303\n      }\n    }\n  ]\n}",
        "invocation_time": 2.061255693435669,
        "cost": 0.0006538900000000001
      }
    ],
    "ingredients": "{\n  \"input\": \"1 teaspoon of Jif peanut butter\",\n  \"language\": \"en\",\n  \"region\": \"us\",\n  \"language_description\": \"English\",\n  \"region_description\": \"United States\",\n  \"query\": [\n    302993\n  ],\n  \"ingredients\": [\n    {\n      \"food_id\": 302993,\n      \"food_name\": \"Natural Creamy Peanut Butter\",\n      \"food_type\": \"Brand\",\n      \"brand_name\": \"Jif\",\n      \"match_accuracy\": 100,\n      \"eaten\": {\n        \"singular_description\": \"teaspoon\",\n        \"plural_description\": \"teaspoons\",\n        \"units\": 1,\n        \"metric_description\": \"g\",\n        \"per_unit_metric_amount\": 4.73,\n        \"total_metric_amount\": 4.73,\n        \"imperial_description\": \"oz\",\n        \"per_unit_imperial_amount\": 0.1667,\n        \"total_imperial_amount\": 0.1667\n      },\n      \"suggested_serving\": {\n        \"serving_id\": \"338024\",\n        \"serving\": \"2 tbsp (33.000 g)\",\n        \"is_default\": 1,\n        \"serving_description\": \"2 tbsp\",\n        \"number_of_units\": 0.0303\n      }\n    }\n  ]\n}",
    "total_cost": 0.0006538900000000001
  },
  {
    "row_index": 5,
    "total_time": 1.3536903858184814,
    "food_count": 1,
    "individual_results": [
      {
        "food_query": 14820902,
        "model_id": "us.amazon.nova-micro-v1:0",
        "actual": "{\n  \"input\": \"2 cups of Trader Joe's low-fat kefir\",\n  \"language\": \"en\",\n  \"region\": \"us\",\n  \"language_description\": \"english\",\n  \"region_description\": \"united states\",\n  \"query\": [\n    \"14820902\"\n  ],\n  \"ingredients\": [\n    {\n      \"food_id\": 14820902,\n      \"food_name\": \"Low Fat Plain Kefir\",\n      \"food_type\": \"Brand\",\n      \"brand_name\": \"Trader Joe's\",\n      \"match_accuracy\": 100,\n      \"eaten\": {\n        \"singular_description\": \"cup\",\n        \"plural_description\": \"cups\",\n        \"units\": 2,\n        \"metric_description\": \"ml\",\n        \"per_unit_metric_amount\": 240,\n        \"total_metric_amount\": 480,\n        \"imperial_description\": \"fl oz\",\n        \"per_unit_imperial_amount\": 8,\n        \"total_imperial_amount\": 16\n      },\n      \"suggested_serving\": {\n        \"serving_id\": \"14019631\",\n        \"serving\": \"1 cup\",\n        \"is_default\": 1,\n        \"serving_description\": \"1 cup\",\n        \"number_of_units\": 2\n      }\n    }\n  ]\n}",
        "invocation_time": 1.3536245822906494,
        "cost": 0.00064537
      }
    ],
    "ingredients": "{\n  \"input\": \"2 cups of Trader Joe's low-fat kefir\",\n  \"language\": \"en\",\n  \"region\": \"us\",\n  \"language_description\": \"english\",\n  \"region_description\": \"united states\",\n  \"query\": [\n    \"14820902\"\n  ],\n  \"ingredients\": [\n    {\n      \"food_id\": 14820902,\n      \"food_name\": \"Low Fat Plain Kefir\",\n      \"food_type\": \"Brand\",\n      \"brand_name\": \"Trader Joe's\",\n      \"match_accuracy\": 100,\n      \"eaten\": {\n        \"singular_description\": \"cup\",\n        \"plural_description\": \"cups\",\n        \"units\": 2,\n        \"metric_description\": \"ml\",\n        \"per_unit_metric_amount\": 240,\n        \"total_metric_amount\": 480,\n        \"imperial_description\": \"fl oz\",\n        \"per_unit_imperial_amount\": 8,\n        \"total_imperial_amount\": 16\n      },\n      \"suggested_serving\": {\n        \"serving_id\": \"14019631\",\n        \"serving\": \"1 cup\",\n        \"is_default\": 1,\n        \"serving_description\": \"1 cup\",\n        \"number_of_units\": 2\n      }\n    }\n  ]\n}",
    "total_cost": 0.00064537
  },
  {
    "row_index": 6,
    "total_time": 1.29876708984375,
    "food_count": 1,
    "individual_results": [
      {
        "food_query": 5931804,
        "model_id": "us.meta.llama4-maverick-17b-instruct-v1:0",
        "actual": "```json\n{\n  \"input\": \"\u0422\u0432\u043e\u0440\u043e\u0433 \u043e\u0431\u0435\u0437\u0436\u0438\u0440\u0435\u043d\u043d\u044b\u0439 140 \u0433\",\n  \"language\": \"ru\",\n  \"region\": \"ru\",\n  \"language_description\": \"russian\",\n  \"region_description\": \"russia\",\n  \"query\": [\n    \"5931804\"\n  ],\n  \"ingredients\": [\n    {\n      \"food_id\": 5931804,\n      \"food_name\": \"\u0422\u0432\u043e\u0440\u043e\u0433 (\u041e\u0431\u0435\u0437\u0436\u0438\u0440\u0435\u043d\u043d\u044b\u0439)\",\n      \"food_type\": \"Generic\",\n      \"brand_name\": \"\",\n      \"match_accuracy\": 100,\n      \"eaten\": {\n        \"singular_description\": \"\u0433\",\n        \"plural_description\": \"\u0433\",\n        \"units\": 1,\n        \"metric_description\": \"g\",\n        \"per_unit_metric_amount\": 140,\n        \"total_metric_amount\": 140,\n        \"imperial_description\": \"oz\",\n        \"per_unit_imperial_amount\": 4.94,\n        \"total_imperial_amount\": 4.94\n      },\n      \"suggested_serving\": {\n        \"serving_id\": \"5755616\",\n        \"serving\": \"100 \u0433 (100.000 \u0433)\",\n        \"is_default\": 1,\n        \"serving_description\": \"100 \u0433\",\n        \"number_of_units\": 1.4\n      }\n    }\n  ]\n}\n```",
        "invocation_time": 1.2987027168273926,
        "cost": 0.0006256300000000001
      }
    ],
    "ingredients": "```json\n{\n  \"input\": \"\u0422\u0432\u043e\u0440\u043e\u0433 \u043e\u0431\u0435\u0437\u0436\u0438\u0440\u0435\u043d\u043d\u044b\u0439 140 \u0433\",\n  \"language\": \"ru\",\n  \"region\": \"ru\",\n  \"language_description\": \"russian\",\n  \"region_description\": \"russia\",\n  \"query\": [\n    \"5931804\"\n  ],\n  \"ingredients\": [\n    {\n      \"food_id\": 5931804,\n      \"food_name\": \"\u0422\u0432\u043e\u0440\u043e\u0433 (\u041e\u0431\u0435\u0437\u0436\u0438\u0440\u0435\u043d\u043d\u044b\u0439)\",\n      \"food_type\": \"Generic\",\n      \"brand_name\": \"\",\n      \"match_accuracy\": 100,\n      \"eaten\": {\n        \"singular_description\": \"\u0433\",\n        \"plural_description\": \"\u0433\",\n        \"units\": 1,\n        \"metric_description\": \"g\",\n        \"per_unit_metric_amount\": 140,\n        \"total_metric_amount\": 140,\n        \"imperial_description\": \"oz\",\n        \"per_unit_imperial_amount\": 4.94,\n        \"total_imperial_amount\": 4.94\n      },\n      \"suggested_serving\": {\n        \"serving_id\": \"5755616\",\n        \"serving\": \"100 \u0433 (100.000 \u0433)\",\n        \"is_default\": 1,\n        \"serving_description\": \"100 \u0433\",\n        \"number_of_units\": 1.4\n      }\n    }\n  ]\n}\n```",
    "total_cost": 0.0006256300000000001
  }
]